"PID","cond","reflection","choicedom","message_choice","pref_cont","CWV","pred_choice","pred_comp","pred_att","keep_1","keep_2","keep_3","keep_4","keep_5","keep_6","keep_7","keep_8","keep_9","keep_10","CWV_1","CWV_2R","CWV_3","CWV_4","CWV_5R","CWV_6","CWV_7R","CWV_8","CWV_9R","CWV_10R","att_1","att_2","is_elg","age","race","edu","income","gender","employment","feedback"
331,"pos","This message will clarify to my employee what is at stake and how hard he is expected to work on this project.",0,"nondom",1,2.2,"do",50,6,11,30,30,45,45,64,65,82,100,100,2,2,3,1,2,4,2,2,2,2,1,1,1,35,"black","4yearColl","$100,001-$120,000","woman","Full-time",NA
332,"pos","It might feel really like a pep talk in a positive they way they  would feel motivated.",0,"nondom",1,3.3,"do",41,6,0,5,10,30,36,40,51,62,77,100,3,3,5,2,3,3,3,5,3,3,1,1,1,42,"white","MA","$180,001-$200,000","woman","Full-time",NA
333,"neg","The message is a bit pushy and also a bit threatening about the bonus.",0,"nondom",1,2.6,"skip",30,2,10,20,30,40,51,60,70,80,90,100,3,3,2,2,3,3,2,1,3,4,1,1,1,35,"white","2yearColl","$0-$20,000","man","NANA",NA
334,"pos","They could feel positively about the manager because the manager is encouraging them to get a bonus for themselves.",0,"nondom",1,2.8,"do",40,6,10,24,38,52,62,72,82,91,100,100,5,2,1,2,2,5,3,3,2,3,1,1,1,41,"black","MA","$100,001-$120,000","woman","Full-time",NA
335,"neg","They might feel like their opinion does not matter, and that what they are doing means so little",1,"dom",5,4.2,"skip",10,3,19,7,40,19,10,22,7,27,12,41,6,2,6,5,3,6,3,5,3,3,0,1,0,28,"black","GED","$0-$20,000","man","Full-time",NA
336,"pos","The positive attitude will be tainted due the words used and how the message is redacted. It feels more like a thread if not respond correctly. But if the relationship is good enough that will encourage worker to do their best.",0,"nondom",1,2.7,"skip",40,3,0,0,0,0,54,59,66,77,86,100,5,2,2,2,2,6,2,2,2,2,1,1,1,40,"hispanic","4yearColl","$120,001-$140,000","man","Full-time",NA
337,"neg","They may feel that their manager only cares about the bonus and about producing an optimal outcome, not about them.",0,"nondom",3,1.9,"do",25,2,10,20,70,80,90,100,100,100,100,100,3,2,1,2,1,2,1,2,3,2,1,1,1,24,"hispanic","4yearColl","$60,001-$80,000","man","Full-time",NA
338,"pos","That's not a very good message. But they might have a non-negative reaction because the message explains what needs to be done and what happens when it is done correctly. They might feel their manager is being clear in their communication with them.",0,"nondom",2,2.4,"skip",50,3,10,20,30,40,50,60,70,80,90,100,2,3,1,3,2,3,1,1,5,3,1,1,1,49,"white","2yearColl","$0-$20,000","woman","NA",NA
339,"neg","They would have a negative reaction to the message because it sounds like a threat, there will not be a bonus if they don't perform well. The way it's worded could trigger resistance in the employee, it sounds like it's an order.",0,"nondom",1,2.1,"do",40,5,20,35,40,50,50,55,65,75,80,100,2,2,2,2,3,3,2,2,1,2,1,1,1,53,"white","MA","$80,001-$100,000","woman","Full-time",NA
340,"pos","I think the employee could have a positive reaction because it sounds like the manager is making it competitive. If the employee is competitive by nature it'll fuel him to want to win.",0,"nondom",2,2.6,"do",25,4,50,50,50,50,50,100,100,100,100,100,5,4,1,1,4,4,1,1,2,3,1,1,1,52,"white","GED","$100,001-$120,000","woman","NANA",NA
341,"pos","This stresses the relationship and the confidence the manager has in employee. The implication is that if employee does his best a bonus will be crested.  This implies that the manager believes the employee can do the task.",0,"nondom",2,2,"do",46,7,50,50,73,72,71,73,76,72,75,79,3,3,1,2,1,3,2,1,1,3,1,1,1,79,"white","4yearColl","$60,001-$80,000","woman","NA",NA
342,"neg","The message sounds very condescending and demanding. It is not necessarily disrespectful but it just seems cold saying do it and do it 100% right or you won’t get paid for it.",1,"dom",4,2.7,"do",50,3,2,4,10,10,10,25,25,49,100,100,6,3,2,2,2,2,3,1,3,3,1,1,1,33,"white","4yearColl","$80,001-$100,000","woman","Full-time",NA
343,"pos","The first two sentences are encouraging and get the blood pumping.  Talk about ""at hand"" or ""it's time"" makes it seem like this is a long anticipated exciting event (even though it's not really haha)",0,"nondom",2,3.4,"do",20,3,100,100,100,100,100,100,100,100,100,100,2,3,2,2,2,7,4,2,5,5,1,1,1,43,"white","PHD","$120,001-$140,000","man","Full-time",NA
344,"pos","The message is giving confidence to the employee by reiterating their skills and encouraging but saying bonus at the end of the reading",0,"nondom",2,4.6,"skip",33,3,1,6,4,4,4,87,32,27,49,95,5,6,2,7,3,6,2,5,5,5,1,1,1,49,"white","PHD","$100,001-$120,000","woman","Full-time","Interesting survey"
345,"neg","The employee will have a negative reaction to that message because the tone is very annoying and threatening.",0,"nondom",1,1.9,"skip",10,1,0,16,17,17,18,32,32,39,40,50,3,2,2,1,1,3,1,2,1,3,1,1,1,31,"asian","4yearColl","$140,001-$160,000","man","Full-time",NA
346,"pos","I think its motivating. It sounds like they want me to succeed and this message doesnt come across as condescending or rude.",1,"dom",6,1.7,"do",42,4,100,100,100,100,100,100,100,100,100,100,1,1,1,1,1,4,2,1,1,4,1,1,1,36,"white","GED","$20,001-$40,000","woman","Full-time",NA
347,"pos","The employee if they are competitive in nature could see that as a fun challenge or game. The trophy is the bonus reward and could help with the motivation to do well.",0,"nondom",3,3.1,"skip",45,6,15,15,25,25,50,50,75,75,100,100,7,4,1,1,1,7,1,2,1,6,1,1,1,37,"white","GED","$60,001-$80,000","man","Full-time",NA
348,"neg","I Think that would be too harsh to send to employees.  In many cases you don't want to punish but rather reward your employees.",0,"nondom",2,4,"do",20,2,10,20,30,40,50,60,70,80,90,100,4,5,3,3,4,5,3,4,4,5,1,1,1,45,"asian","MA","$100,001-$120,000","man","Full-time",NA
349,"pos","manager is encouraging and cheering me on, they believe in me to do the task
",0,"nondom",2,3.9,"skip",40,3,29,38,57,69,77,85,92,95,96,100,5,6,2,3,5,5,2,3,3,5,1,1,1,NA,"white","4yearColl","$160,001-$180,000","woman","NA",NA
350,"pos","The message is brief and straightforward. It does not feel patronizing and it indicates a level of confidence in the employee's ability to complete the task.",1,"dom",5,4,"do",30,5,0,0,0,0,5,9,15,25,75,100,5,4,2,5,4,5,4,3,5,3,1,1,1,25,"asian","4yearColl","$60,001-$80,000","man","Full-time",NA
351,"neg","It sounds like the employee might hear: You have to do this. You have to do that, And, your livelihood depends on this task. It's quite ominous.",0,"nondom",1,3.5,"do",30,3,10,30,41,54,61,67,72,78,86,100,5,3,2,5,3,5,4,2,1,5,1,1,1,49,"white","GED","$20,001-$40,000","woman","Full-time","thank you"
352,"pos","It's straightforward and clear. It explains the whole goal clearly.",1,"dom",4,2.6,"do",41,6,5,5,5,5,5,5,10,10,20,30,3,3,1,1,2,4,2,1,5,4,1,1,1,20,"black","GED","$40,001-$60,000","man","NA",NA
353,"pos","It encourages them to do their best so they can get as much money as possible.",0,"nondom",2,4.1,"do",30,2,0,9,23,32,45,55,65,82,99,100,5,6,1,5,2,5,3,2,6,6,1,1,1,43,"white","GED","$60,001-$80,000","woman","Full-time",NA
354,"pos","The message could give the employee a sense of hope and a little challenge in knowing that they could receive the full bonus.",0,"nondom",2,3.1,"do",38,3,30,30,30,50,50,100,100,100,100,100,5,3,2,4,3,1,4,1,5,3,1,1,1,24,"black","4yearColl","$100,001-$120,000","man","Full-time",NA
355,"neg","The text is not encouraging and, instead, the participant might see the message as belittling and manipulative.",0,"nondom",1,5.1,"skip",25,1,100,100,100,100,100,100,100,100,100,100,6,7,3,3,4,5,4,6,6,7,1,1,1,27,"asian","4yearColl","$40,001-$60,000","man","Full-time","No additional comments"
356,"pos","I believe the employee could feel that their manager believes in their ability to do this task.",0,"nondom",3,4.3,"do",41,4,10,20,30,40,50,60,70,80,90,100,5,4,5,5,3,5,5,5,3,3,1,1,1,43,"asian","4yearColl","$160,001-$180,000","man","Full-time",NA
357,"neg","The employee might have a negative reaction to the message because it directly subjects them to the association of their bonus with their performance, which can potentially pressure them.",1,"dom",4,3.9,"do",36,3,0,3,6,8,11,12,14,21,23,27,5,3,3,5,3,3,3,5,6,3,1,1,1,22,"asian","4yearColl","$180,001-$200,000","man","Full-time",NA
358,"neg","This message is somewhat demanding and punitive.  It threatens poor performance with reduced bonus, which could make an employee resentful or fearful towards the manager.  This is not a productive way to build trust and rapport with an employee, in my opinion.",0,"nondom",2,3,"skip",35,2,30,35,40,50,60,70,100,100,100,100,5,2,2,2,2,4,3,2,4,4,1,1,1,52,"white","4yearColl","$120,001-$140,000","man","Full-time",NA
359,"pos","The harder they work, the more bonus they can potentially receive",0,"nondom",1,1,"do",50,7,100,100,100,100,100,100,100,100,100,100,1,1,1,1,1,1,1,1,1,1,1,1,1,37,"asian","2yearColl","$120,001-$140,000","man","Full-time",NA
360,"neg","The employee may feel pressured and undervalued by the manager's emphasis on the bonus, leading them to believe that their worth is tied solely to performance rather than their overall contributions. It could make them resentful, lose motivation, and may perceive the manager as unsupportive and demanding.",0,"nondom",1,1.7,"skip",35,2,45,30,20,5,5,3,10,6,8,5,1,2,2,1,1,2,1,1,2,4,1,0,0,28,"asian","2yearColl","$20,001-$40,000","woman","Full-time",NA
361,"neg","It could come off as passive aggressive and they may feel inclined to do bad out of spite.",0,"nondom",1,1.5,"do",50,6,100,100,100,100,100,100,100,100,100,100,2,1,1,1,1,4,1,1,2,1,1,1,1,21,"white","GED","$100,001-$120,000","woman","NANA",NA
362,"pos","The employee might react positively to the message to ensure they receive the full bonus.",0,"nondom",1,1,"do",50,3,100,100,100,100,100,100,100,100,100,100,1,1,1,1,1,1,1,1,1,1,1,1,1,66,"white","4yearColl","$120,001-$140,000","woman","Full-time","Thank you!"
363,"neg","The statement ends by emphasizing the negative consequence of not achieving the goal. Ending on a negative note could invoke negative responses.",0,"nondom",2,2.2,"do",45,5,100,100,100,100,100,100,100,100,100,100,3,2,1,1,1,6,2,2,2,2,1,1,1,27,"white","4yearColl","$80,001-$100,000","man","Full-time",NA
364,"pos","The manager sounds like they are being encouraging.  The employee could react positively in that they could feel that the manager is looking out for their interest in making sure they get the full bonus.",0,"nondom",3,2.4,"do",46,3,7,17,29,40,53,65,74,86,96,100,2,2,1,2,4,3,2,2,3,3,1,1,1,47,"white","4yearColl","$140,001-$160,000","man","Full-time",NA
365,"neg","In this message it is right to the point however it is very rude and not very encouraging.  I feel this message could make the employee nervous and worry some, by applying too much pressure on the employee.",0,"nondom",3,2.6,"skip",25,1,10,21,28,36,44,53,63,72,82,100,5,2,1,1,2,3,1,1,5,5,1,1,1,34,"white","GED","$0-$20,000","man","Full-time","No"
366,"pos","The tone of this message has a threatening quality. It also implies the absolute best hasnt been applied in previous situations. These seem like orders and as an employee would probably tune out with a bit of resentment regarding the tone",0,"nondom",3,2.7,"do",19,3,10,21,30,40,50,60,70,80,90,100,4,3,1,7,1,3,1,1,3,3,1,1,1,50,"black","MA","$140,001-$160,000","woman","Full-time",NA
367,"neg","They might think it is negative because you are putting a lot of pressure on them.",0,"nondom",1,1.9,"do",39,4,50,51,50,50,50,50,50,100,100,100,4,4,1,1,1,4,1,1,1,1,1,1,1,37,"white","4yearColl","$60,001-$80,000","man","Full-time",NA
368,"pos","This message gets across confidence in their employee, the manager expresses trust that the employee knows the task, and trusts them to get in there and do it. Potentially the employee understands the sentiment of a bonus as a positive motivator.",0,"nondom",2,3,"do",35,2,0,0,0,0,0,15,0,0,0,85,3,2,2,4,1,5,2,2,5,4,1,1,1,44,"white","4yearColl","$120,001-$140,000","woman","NA",NA
369,"pos","Assuming the employee respects their manager, they will want to prove and reinforce their capabilities, meaning their motivated and focused to perform well.",0,"nondom",2,2.2,"do",46,5,0,0,0,0,50,50,50,50,50,100,3,3,1,1,1,5,2,2,2,2,1,1,1,33,"white","4yearColl","$80,001-$100,000","woman","Full-time",NA
370,"pos","The employee might feel that their manager believes they are competent and skilled and that this message is their way of encouraging the employee to perform their best. The employee might feel motivated to work hard.",0,"nondom",2,3.6,"skip",15,1,10,20,30,50,60,65,75,85,100,100,5,2,2,5,2,6,2,5,3,4,1,1,1,30,"asian","4yearColl","Over $200,000","woman","Full-time",NA
371,"neg","Well, the message is a threat, and no one likes being threatened. Even if the employee is a bit more motivated because they now know the cost of failure, they'll remember that their manager threatened them to do well ""or else.""",0,"nondom",1,3.5,"do",30,1,10,20,30,40,50,60,70,80,90,100,5,4,2,4,3,5,3,3,3,3,1,1,1,37,"asian","MA","$100,001-$120,000","man","Full-time","None"
372,"neg","they might have a negative reaction to it because it seems harsh and blunt without a lot of niceness added",0,"nondom",3,2.8,"do",38,3,8,25,37,48,63,74,81,86,95,100,3,3,3,2,3,3,3,2,3,3,1,1,1,27,"white","4yearColl","$100,001-$120,000","woman","Full-time",NA
373,"pos","If the employee and the manager have a good relationship built on trust and respect then the employee will be all in on the task and put forth maximum effort.",0,"nondom",2,2,"skip",25,4,10,10,10,25,25,30,25,40,30,25,2,1,1,1,2,5,2,2,2,2,1,1,1,50,"black","4yearColl","$80,001-$100,000","man","Full-time","Thank you for the opportunity to share my thoughts."
374,"neg","My employee might have a negative reaction to this message because it makes me sound bossy and pushy as a boss and manager of him/her and that I expect too much out of him/her.  It also makes it appear that I am perfectionist boss who expects my employees to perform flawless always otherwise, I won't pay them and that I am unforgiving about any of their mistakes, which could lead to me having a bad relationship with my employees and cause my employees to quit because my employees may feel that I am an overbearing, perfectionistic, pushy, and bossy manager.",0,"nondom",1,3,"do",50,7,30,45,55,60,65,70,80,85,90,100,5,7,1,1,1,5,3,1,3,3,1,1,1,40,"asian","MA","$80,001-$100,000","woman","Full-time","It was a fun survey, and I hope you will approve of my work.  Thank you!"
375,"pos","They might think that the manager is dedicated and decisive. If the manager has the ability to handle the instruction with clarity then hopefully he or she can teach the material with clarity as well. It seems as if the manager cares about rewarding good work and will do so fairly",0,"nondom",3,3,"do",30,6,8,18,29,38,48,58,69,78,89,100,4,4,2,2,2,5,3,2,4,2,1,1,1,32,"white","4yearColl","$60,001-$80,000","man","Full-time","fun"
376,"pos","It’s not very encouraging, it seems harsh. I would not feel motivated to complete my tasks. Feels like pep talk done poorly",0,"nondom",1,3.2,"do",25,3,57,51,60,79,79,96,90,90,50,50,5,4,1,4,4,5,3,1,3,2,1,1,1,29,"hispanic","GED","$120,001-$140,000","man","Full-time",NA
377,"pos","My manager is just a person who supervise my work. He is really nothing close to me.",1,"dom",5,3.4,"do",30,4,55,56,76,72,45,68,75,77,31,46,4,4,3,4,3,4,2,3,4,3,0,1,0,24,"asian","4yearColl","$60,001-$80,000","man","NA",NA
378,"neg","This message sounds too negative and forceful. I think this would make the employee not work as hard out of spite.",0,"nondom",1,1.1,"do",20,2,60,54,57,55,49,42,35,38,37,38,1,1,1,1,2,1,1,1,1,1,1,1,1,37,"white","PHD","$160,001-$180,000","man","Full-time",NA
379,"pos","They might believe that the manager has confidence in them to complete the task well.",0,"nondom",2,2.1,"do",40,3,10,20,30,40,50,60,70,80,90,100,3,1,3,2,1,3,2,1,3,2,1,1,1,23,"white","4yearColl","$100,001-$120,000","man","NA",NA
380,"neg","They may feel concerned that this may be a trick, and there could be a good chance even if they did relatively well they may still miss a good portion of the bonus.",1,"dom",5,1.4,"do",45,3,0,10,15,20,35,50,65,80,90,100,2,1,1,1,2,1,1,1,2,2,1,1,1,51,"white","2yearColl","$80,001-$100,000","man","Full-time",NA
381,"neg","It seems kind of pushy, or bossy. Yes, I know that I am the boss but this is not the way I would address anyone if I wanted positive results.",0,"nondom",1,2.3,"do",30,2,61,74,86,100,100,100,100,100,100,100,2,2,3,2,3,3,2,2,2,2,1,1,1,28,"white","GED","$20,001-$40,000","woman","Full-time",NA
382,"neg","The employee reading this message might take the meesage the wrong way because he may feel like it's an absolute necessity that he finishes the tasks so that he can receive the bonus.",0,"nondom",2,4.6,"do",50,3,0,0,0,0,50,50,50,50,90,100,7,4,4,6,4,4,5,6,2,4,1,1,1,27,"white","GED","$20,001-$40,000","man","Full-time","Thank you"
383,"pos","The positive response might be that they are encouraged to try their best because they want that full bonus, and I think that the language is very, ""Let's get to it and do this!"" which can be encouraging.",1,"dom",5,1.1,"do",31,5,82,92,97,99,100,100,100,100,100,100,1,1,1,2,1,1,1,1,1,1,1,1,1,NA,"white","MA","$60,001-$80,000","woman","Full-time","N/A"
384,"pos","They could see the manager as being direct and straightforward. This message makes it clear that their bonus is at stake which could motivate them to do better than if this was not stated, which would be appreciated.",1,"dom",5,2.1,"do",38,5,0,10,25,50,57,65,75,83,90,100,2,3,1,2,1,1,3,1,5,2,1,1,1,37,"white","4yearColl","$60,001-$80,000","woman","Full-time","Fun survey!"
385,"pos","They might think that the manager knows that they know what to do and thinks that they are competent enough to know the task.",0,"nondom",1,3.4,"do",26,3,0,5,10,15,22,35,51,72,85,100,3,3,2,5,3,3,2,3,5,5,1,1,1,23,"asian","4yearColl","$80,001-$100,000","woman","Full-time",NA
386,"neg","The employee might feel distrusted and that the manager only cares about their own bonus, negatively impacting their attitude.",0,"nondom",2,3.3,"do",35,3,0,10,20,30,40,50,60,70,80,90,4,3,3,3,3,4,3,2,4,4,1,1,1,33,"white","4yearColl","$80,001-$100,000","woman","Full-time",NA
387,"neg","It comes off as slightly condescending as if there is a consequnce with the shapes are not picked correctly. Also, it's slightly threatning to say if the group doesn't get it done then there is no bonus, it perceives as the bonus is the most important above everyone else.",0,"nondom",1,2.2,"do",25,4,5,10,15,20,24,30,35,50,75,100,2,4,1,2,4,2,1,1,1,4,1,1,1,37,"black","4yearColl","$80,001-$100,000","man","Full-time","This was an interesting and great survey. I enjoyed the questions!"
388,"neg","People generally respond negatively to threats, and when they are made to fear that they will not be able to earn something that was promised to them.  It is demoralizing and does not improve performance",0,"nondom",1,1.1,"do",35,5,50,50,51,49,51,100,100,100,100,100,1,1,1,1,1,1,1,1,1,2,1,1,1,39,"white","PHD","$40,001-$60,000","man","Full-time",NA
389,"pos","The message is clear and straight to the point. It is just a friendly reminder to perform as best as they can.",1,"dom",5,3.4,"do",35,6,10,20,27,37,45,55,64,76,85,100,5,5,3,2,3,5,2,5,2,2,1,1,1,37,"white","2yearColl","$60,001-$80,000","man","Full-time","No additional comments."
390,"pos","The message is very encouraging. It motivates employees and encourages them to do their best.",1,"dom",5,1.1,"do",40,6,0,0,0,0,0,0,0,0,0,50,1,2,1,1,1,1,1,1,1,1,1,1,1,26,"black","4yearColl","$80,001-$100,000","woman","Full-time",NA
391,"pos","The second sentence in the paragraph is very encouraging and is pushing them to do their best.",1,"dom",4,2.1,"do",40,5,13,34,50,62,66,70,75,80,88,100,2,1,1,1,4,2,2,1,4,3,1,1,1,32,"white","2yearColl","$40,001-$60,000","man","Full-time",NA
392,"neg","There is a threat of a small or no bonus for poor performance which isn't enticing.",0,"nondom",1,3.3,"skip",20,2,25,30,40,50,70,75,80,100,100,100,6,5,2,2,1,6,2,2,2,5,1,1,1,41,"asian","2yearColl","$100,001-$120,000","man","Full-time","Thank you!"
393,"pos","...there wouldn't be I feel like I'm being motivated even though I'm already motivated enough. Also annoying so-to-speak statements like ""get in there"" follow by capitalist nonsense ""PERFORM WELL OR ELSE NO PAY"" no. So I'll lie - the ""employee"" might feel positively towards their ""boss"" because the ""boss"" is ""offering"" a ""bonus"".",0,"nondom",2,2.7,"skip",20,2,100,100,100,100,100,100,100,100,100,100,1,2,1,1,4,5,2,2,5,4,1,1,1,28,"white","4yearColl","$20,001-$40,000","man","NANA",NA
394,"pos","The manager is being positive by cheering her on. Even mentioned the bonus to give the employee a nice little push.",0,"nondom",1,2.6,"do",50,7,100,100,100,100,100,100,100,100,100,100,5,2,3,1,1,5,1,1,5,2,1,1,1,51,"white","2yearColl","$40,001-$60,000","woman","NA",NA
395,"neg","The employee might feel pressured and undervalued, interpreting the message as harsh, with more emphasis on consequences than support. This could lead to a sense that the manager lacks empathy and appreciation for their efforts.",0,"nondom",1,2.2,"do",5,2,10,20,30,40,50,60,70,80,90,100,1,7,1,1,1,7,1,1,1,1,1,1,1,38,"black","4yearColl","$80,001-$100,000","man","NA",NA
396,"neg","It puts a lot of pressure on the employee to perform well that might not be well received. They may not feel encouraged to try their best even if they make a mistake.",0,"nondom",3,1.8,"skip",30,2,10,20,30,40,50,60,70,80,90,100,2,3,1,1,1,2,1,1,1,5,1,1,1,22,"white","GED","$20,001-$40,000","woman","NA",NA
397,"neg","The last sentence of this message almost feels like a threat. Instead of saying ""if you do well, you get a bonus"" it's very negative by saying what WON'T happen (""if you don't do well, you won't get the full bonus"")",0,"nondom",3,2.8,"do",43,3,5,15,15,55,55,55,80,80,100,100,5,2,2,3,3,2,3,2,3,3,1,1,1,26,"white","4yearColl","$80,001-$100,000","woman","NA","n/a"
398,"neg","It sounds more demanding rather than just asking. It makes me think that I am forced to get them all right, if not then I won't receive anything at all.",0,"nondom",1,2.4,"skip",5,2,12,20,25,30,40,40,50,60,70,80,3,2,2,2,2,4,2,2,2,3,1,1,1,26,"hispanic","GED","$80,001-$100,000","woman","Full-time",NA
399,"neg","The employee might feel pressured or micromanaged by the store by the tone of the message interpreting it as controlling or overly demanding this could make them feel undervalued or distrusted and potentially straining their relationship with the manager.",0,"nondom",1,3.5,"do",32,6,5,7,12,19,22,26,33,38,42,48,3,2,6,4,1,5,3,5,2,4,1,1,1,38,"white","4yearColl","$60,001-$80,000","woman","Full-time","had a great study"
400,"neg","The last sentence: if you don't complete it and do well, you will not get the full bonus. This is what adds a negative connotation to the message. It might make the employee turn the task into an emotional one. Giving them performance anxiety and may cause them to make a mistake",0,"nondom",1,2.4,"do",30,2,0,0,0,0,10,15,15,20,20,20,2,5,2,1,2,5,2,1,1,3,1,1,1,33,"white","2yearColl","$60,001-$80,000","man","Full-time",NA
401,"pos","It's a motivating message that gets right to the point. They know where this manager is coming from.",0,"nondom",3,3.1,"do",30,5,25,40,50,60,70,75,80,90,95,100,5,5,3,3,3,5,1,1,2,3,1,1,1,45,"white","GED","$40,001-$60,000","man","Full-time",NA
402,"pos","They would react as if they were a key player that was specifically chosen for the task and should try their hardest to complete it well and on time. It would feel honored that their manager chose them for the specific task and would feel a tremendous amount of responsibility to not let them down.",0,"nondom",2,3.1,"do",24,5,3,4,5,12,18,24,33,41,58,82,3,5,2,2,1,6,1,6,2,3,1,1,1,31,"white","4yearColl","$60,001-$80,000","man","Full-time",NA
403,"pos","They could react positively to message by seeing the manager has confidence in them. The opening sentence implies that the manager believes the employee is already competent and trusts them to know what to do.",0,"nondom",1,3.1,"do",40,6,10,20,30,35,40,45,50,70,85,100,6,5,1,4,5,5,1,1,2,1,1,1,1,23,"asian","4yearColl","$40,001-$60,000","man","NA","Pretty thought provoking"
404,"neg","I feel that the statement is negative because it is very strong, and is overall negative. It comes across as that the employee is not automatically going to succeed.",0,"nondom",3,3.8,"do",35,3,11,13,22,29,34,41,50,70,82,100,5,3,4,2,4,4,5,3,3,5,1,1,1,43,"white","4yearColl","$140,001-$160,000","woman","NA",NA
405,"neg","I think it sends a bit of an ultimatum. It starts out positively, but then calling out not getting a full bonus kinda makes it feel negative. I would not be inspired by a manager like this.",0,"nondom",2,1.6,"do",41,6,19,30,42,52,61,64,72,80,91,100,3,1,1,1,1,3,1,1,2,2,1,1,1,53,"white","MA","Over $200,000","man","Full-time",NA
406,"pos","They may not have a negative effect because they see their manager being completely candid in telling them that their performance is completely correlated to the bonus",1,"dom",5,4,"do",43,5,5,9,30,40,45,50,81,85,91,100,6,2,2,6,4,2,3,6,5,4,1,1,1,24,"asian","4yearColl","$140,001-$160,000","woman","Full-time",NA
407,"neg","This message is not encouraging it is threatening. It is written as if you assume that they will not work hard and do their best. Therefore, it is actually quite negative.",0,"nondom",1,2.8,"skip",30,2,21,20,30,40,50,60,70,80,89,100,2,3,1,2,5,3,2,4,3,3,1,1,1,76,"white","2yearColl","$80,001-$100,000","woman","Full-time","none"
408,"neg","It’s not encouraging, it’s threatening them. “Do well or lose money.” That leads to workplace resentment.",0,"nondom",1,1.8,"do",50,7,30,30,40,50,60,70,80,90,95,100,4,1,1,1,1,4,1,1,1,3,1,1,1,26,"white","GED","$20,001-$40,000","woman","Full-time",NA
