"PID","cond","reflection","choicedom","message_choice","pref_cont","CWV","pred_choice","pred_comp","pred_att","keep_1","keep_2","keep_3","keep_4","keep_5","keep_6","keep_7","keep_8","keep_9","keep_10","CWV_1","CWV_2R","CWV_3","CWV_4","CWV_5R","CWV_6","CWV_7R","CWV_8","CWV_9R","CWV_10R","att_1","att_2","is_elg","age","race","edu","income","gender","employment","feedback"
248,"pos","The employee might feel respected and trusted by their manager, believing that their efforts are appreciated and the manager genuinely cares about their success. This positive perception can cultivate loyalty and a stronger sense of commitment to preforming at their best.",1,"dom",6,4,"do",37,6,55,61,73,52,65,48,55,49,50,61,5,3,6,5,2,6,4,5,1,3,1,1,1,58,"black","4yearColl","$60,001-$80,000","man","Full-time",NA
249,"neg","the message sounds very aggressive and confrontational",0,"nondom",1,3.8,"do",35,2,11,23,33,43,54,64,72,81,91,100,5,5,5,5,2,6,2,1,5,2,1,1,1,44,"white","4yearColl","$80,001-$100,000","man","Full-time",NA
250,"pos","The employee might appreciate the directness and clear expectations from the manager, valuing the manager's honesty about the bonus being tied to performance. This could foster a sense of trust and transparency in their professional relationship.",0,"nondom",1,3.2,"do",30,2,4,10,20,30,40,50,60,71,80,100,6,2,6,2,2,6,2,2,2,2,1,1,1,44,"white","4yearColl","$100,001-$120,000","man","Full-time",NA
251,"pos","The manager acknowledges that the employee has an understanding of the task.  This will make the employee feel intelligent and is positive.",1,"dom",5,1.7,"do",30,6,14,25,35,46,57,70,85,94,97,100,2,3,1,1,1,2,1,1,2,3,1,1,1,54,"white","4yearColl","Over $200,000","man","Full-time",NA
252,"neg","It says the statement ""if you don't complete it and do it well"" and then lists a consequence, you will not get the full bonus. It is concentrating on all negative things.",0,"nondom",1,3.8,"skip",40,3,100,100,100,100,100,100,100,100,100,100,5,3,5,3,3,5,3,5,3,3,1,1,1,34,"white","4yearColl","$140,001-$160,000","woman","Full-time",NA
253,"neg","The employee would likely have a negative perception of me if I chose to send this message because it comes off as strict and demeaning. I would not choose this message because it expects a lot from a stranger, and I think they would not care about me or the task at hand because they would see the situation as not that serious then perform poorly.",0,"nondom",1,3.1,"do",40,5,0,5,10,20,30,40,50,70,85,100,3,3,6,2,2,5,3,1,3,3,1,1,1,33,"white","GED","$0-$20,000","man","NA",NA
254,"pos","The manager has a friendly demeanor and seems to want me to reach my full potential.",0,"nondom",2,2,"do",36,5,0,0,0,0,74,0,74,0,0,100,2,2,2,1,1,2,2,2,3,3,1,1,1,NA,"white","4yearColl","$100,001-$120,000","woman","NA",NA
255,"neg","The employee might feel as though you have little confidence in their integrity and work ethic and therefore feel the need to threaten them with their bonus to make them perform their work adequately.",1,"dom",6,3.4,"do",50,4,0,10,15,20,25,30,35,40,45,100,5,4,2,2,3,5,2,2,5,4,1,1,1,47,"white","4yearColl","$160,001-$180,000","man","Full-time","none"
256,"pos","They might act positively to this thinking that they need to work really hard to get the bonus and they know up front what needs to be done and what's expected. So it's pretty transparent that the better they do the more bonus that they'll receive.",0,"nondom",1,2.9,"do",50,2,20,30,40,50,60,70,80,90,95,100,6,1,3,2,1,2,3,2,7,2,1,1,1,57,"white","4yearColl","$20,001-$40,000","man","Full-time",NA
257,"pos","It does insinuate that you are capable of doing the project well enough for the full bonus. It also clearly lays out why you should pay attention to the assignment.",0,"nondom",1,2.3,"do",40,3,62,68,74,77,81,84,90,93,98,100,2,3,2,2,3,2,2,2,2,3,1,1,1,NA,"white","MA","$120,001-$140,000","woman","Full-time",NA
258,"pos","The employee might have a positive impact or reaction to the message above only by knowing that the manager would want the absolute best for them. Also, knowing that the manager is a no-nonsense manager and frowns on failure would serve as a motivation.",0,"nondom",1,4.7,"skip",20,3,45,45,45,45,50,56,70,100,100,100,7,1,6,6,5,5,1,5,5,6,1,1,1,26,"black","4yearColl","$140,001-$160,000","man","Full-time",NA
259,"neg","The message comes off demanding and cold, if I were the employee this would not motivate me to do well.",0,"nondom",1,2.5,"do",10,2,10,20,30,40,50,60,70,80,90,100,5,5,1,1,1,6,2,1,1,2,1,1,1,27,"white","GED","$80,001-$100,000","man","NA",NA
260,"neg","They might think this message is very demanding and will react by thinking negatively towards the manager because he seems overbearing and stern.",0,"nondom",1,2,"do",36,3,7,17,28,40,53,65,75,86,94,100,3,1,2,2,2,3,1,1,2,3,1,1,1,63,"white","2yearColl","$20,001-$40,000","man","Full-time",NA
261,"pos","They'll reach positively because I'm giving them words of encouragement and advice to do well. I win if they win.",1,"dom",6,2.3,"do",49,6,15,30,44,61,75,75,100,100,100,100,4,2,1,2,2,5,2,1,2,2,1,1,1,32,"other","4yearColl","$40,001-$60,000","woman","Full-time",NA
262,"pos","The employee might appreciate the mangers honesty and clear expectation, which can foster trust and motivate them to perform their best. They may also feel valued through direct communication, strengthening their respect for the manager.",0,"nondom",1,2.3,"do",29,6,5,20,40,54,54,58,62,65,72,78,2,2,1,1,2,5,2,4,2,2,1,1,1,39,"white","4yearColl","$100,001-$120,000","man","Full-time",NA
263,"neg","The employee might feel pressured or micromanaged, interpreting the message as demanding and unsupportive. this could lead them to view the manager as more focused on their own bonus than on encouraging mutual success.",0,"nondom",1,3.8,"do",37,5,13,20,29,37,43,50,58,64,72,82,4,3,5,6,2,5,4,5,1,3,1,1,1,45,"white","4yearColl","$60,001-$80,000","man","Full-time","Great survey, Thanks!"
264,"pos","They could be happy that the boss is encouraging to their best and use that as a motivator",1,"dom",5,4.1,"do",45,5,44,56,66,66,56,69,67,62,76,52,5,4,4,4,4,5,3,5,4,3,1,1,1,27,"black","2yearColl","$40,001-$60,000","woman","Full-time","nope"
265,"pos","Even though it's hard to imagine getting a positive reaction to this message, maybe this kind of message could make a person feel more determined, and be grateful to the manager for being straightforward and honest about his expectations and the consequences of failing.",0,"nondom",1,1.7,"skip",40,2,10,30,40,50,50,70,80,90,100,100,2,2,1,2,1,2,1,1,2,3,1,1,1,30,"white","MA","$40,001-$60,000","woman","NA",NA
266,"pos","i guess they would need to see this as tough love. this is rather factual rather than positive",0,"nondom",1,2.8,"skip",5,3,100,100,100,100,100,100,100,100,100,100,5,3,1,2,3,3,3,2,3,3,1,1,1,59,"white","4yearColl","$20,001-$40,000","woman","NA",NA
267,"neg","They might be worried about not receiving a bonus despite their best efforts",0,"nondom",3,3.1,"do",30,4,3,13,18,30,38,46,61,70,85,100,5,3,1,3,3,4,2,3,2,5,1,1,1,32,"white","4yearColl","$20,001-$40,000","man","Full-time",NA
268,"neg","It shows that their bonus is only contingent on this particular task. It does not look at the employee as a whole and their efforts in their day-to-day job.",0,"nondom",2,2.6,"do",40,2,100,100,100,100,100,100,100,100,100,100,3,3,2,2,2,2,3,2,4,3,1,1,1,38,"white","4yearColl","$80,001-$100,000","woman","Full-time",NA
269,"neg","The second sentence is framed with a negative outcome (""you will not get the full bonus"").  This may discourage the employee. It would be better to make a positive statement of the results of doing well.",0,"nondom",2,1.6,"do",35,3,10,20,70,75,80,92,94,96,98,100,1,2,2,2,1,1,2,1,2,2,1,1,1,63,"white","MA","$100,001-$120,000","man","Full-time","none"
270,"neg","I think the above message is suggesting that the employee doesn’t normally do their best work. I would find it a little insulting. The message doesn’t sound very trusting of the employee",0,"nondom",2,1.5,"skip",45,2,100,100,100,100,100,100,100,100,100,100,2,2,1,1,1,2,1,1,2,2,1,1,1,44,"white","4yearColl","$100,001-$120,000","woman","Full-time",NA
271,"neg","My manager does not care about me. All he cares about is his own bottom-line.",0,"nondom",1,2,"skip",20,1,100,100,100,100,100,100,100,100,100,100,1,1,1,1,1,6,1,1,1,6,1,1,1,49,"white","4yearColl","$120,001-$140,000","man","Full-time",NA
272,"neg","it sounds absolutist to me the person who sees this message will feel more pressure to complete the task flawlessly. The message does not encourage, instead it berates the user to perform well or else",0,"nondom",1,1.7,"do",35,2,10,20,30,40,50,75,100,100,100,100,1,2,1,1,2,2,3,1,2,2,1,1,1,29,"white","GED","$60,001-$80,000","man","Full-time",NA
273,"pos","They could look up to their manager because the manager motiviates his workers.  The manager might motivate them to do their best and to work hard for their goals, and the manager might show that he cares by investing time and training with their workers.",0,"nondom",1,2,"do",45,7,100,100,100,100,100,100,100,100,100,100,3,2,1,1,1,5,1,1,2,3,1,1,1,41,"hispanic","4yearColl","$40,001-$60,000","woman","Full-time",NA
274,"neg","i thunk he may be annoyed by the pressure and scared he may lose his job",0,"nondom",3,4.1,"do",29,5,6,7,21,48,60,63,66,87,94,100,3,3,5,4,5,4,4,4,5,4,1,1,1,45,"black","4yearColl","$120,001-$140,000","man","Full-time",NA
275,"neg","The message has a cold tone to it and is more or less about the bottom line. It's not encourgaging it's more so demanding.",0,"nondom",1,3.7,"do",40,3,100,100,100,100,100,100,100,100,100,100,7,4,5,3,2,6,2,2,2,4,1,1,1,33,"black","4yearColl","$40,001-$60,000","woman","NA",NA
276,"pos","This Can Motivate and Help and Encourage Them To At Least Try Their Best and Work Very Hard to Earn the Bonus and Not Stress Out or Pressure Themselves and Don't Slack Off With This Task.",1,"dom",4,2.2,"do",30,5,50,50,50,75,75,100,100,100,100,100,1,2,2,2,1,4,5,1,1,3,1,1,1,24,"black","GED",NA,"man","NA",NA
277,"neg","this message sounds like a threat and it focuses on the negative consequence.",0,"nondom",2,2.7,"skip",10,2,18,30,48,56,70,72,79,85,89,100,3,3,3,2,2,3,3,2,3,3,1,1,1,49,"asian","4yearColl","$160,001-$180,000","woman","NA",NA
278,"neg","I do not feel the message has any words of encouragement. It lacks enthusiasm and appreciation. Further, the message is focusing on consequences over motivation.",0,"nondom",1,1.7,"do",25,2,10,20,30,40,50,60,70,80,90,100,4,1,1,1,1,4,1,1,1,2,1,1,1,51,"white","GED","$20,001-$40,000","woman","Full-time","Thank you for this unique study. I really enjoyed it. Have a great day."
279,"neg","The employee might be pressured or undervalued, thinking the manager is only focused on result or not on their well-being, which could lead to frustration or depressed motivation.",1,"dom",5,3.8,"do",30,5,60,70,60,80,70,60,70,60,70,80,5,2,5,4,4,4,4,5,2,3,1,1,1,72,"black","4yearColl","$40,001-$60,000","woman","Full-time","Thanks for giving this opportunity."
280,"neg","it would feel as though they will look down on you if you don't do well or are not good enough if you don't recieve the bonus.  it would make me not want to try hard as it feels like part of the aspect should be to have fun",0,"nondom",2,3.1,"skip",17,3,19,30,39,46,50,55,61,65,78,91,2,3,3,5,3,3,3,3,3,3,1,1,1,48,"white","2yearColl","$80,001-$100,000","man","Full-time",NA
281,"pos","they might have a positive reaction knowing there is a bonus and working towards that bonus. They might be grateful towards the manager for offering a bonus.",1,"dom",5,1.4,"do",35,6,25,40,50,60,70,75,80,85,90,100,1,2,1,1,1,4,1,1,1,1,1,1,1,31,"white","4yearColl","$20,001-$40,000","man","Full-time",NA
282,"neg","They might feel more stressed or pressured into completing the task",0,"nondom",3,2.8,"do",40,3,10,20,33,47,62,75,90,94,100,100,5,2,1,3,2,3,3,1,4,4,1,1,1,32,"white","4yearColl","$140,001-$160,000","man","Full-time",NA
283,"pos","I think they may be motivated and want to do well to get the bonus.",0,"nondom",1,1.6,"do",30,3,4,25,36,45,52,65,75,90,95,100,1,3,2,1,1,1,1,1,1,4,1,1,1,50,"white","4yearColl","$60,001-$80,000","woman","Full-time","n/a"
284,"neg","This message comes across as rude and demanding. By saying the employee will not get the full bonus if they fail to complete this task is threatening!",0,"nondom",1,3.9,"skip",9,1,20,50,60,75,75,74,75,75,100,100,7,1,1,2,1,7,1,7,7,5,1,1,1,44,"white","4yearColl","$60,001-$80,000","woman","Full-time","Thank you very much!"
285,"pos","I think some people would act positively to this message.  They may like the thought that their fate is in their own hands and find that motivating.",0,"nondom",2,1.9,"do",40,6,100,100,100,100,100,100,100,100,100,100,2,1,1,1,3,3,2,1,3,2,1,1,1,64,"white","MA","$40,001-$60,000","woman","Full-time",NA
286,"pos","It is very direct to the point. It gives them specific direction on what to do.",0,"nondom",1,2.2,"skip",41,2,10,10,40,50,60,60,80,80,100,100,2,3,2,2,2,3,2,2,2,2,1,1,1,54,"white","MA","Over $200,000","man","Full-time",NA
287,"pos","The employee might feel that the manager believes in their abilities and is counting on them, which could create a sense of trust and mutual responsibility. They may also appreciate the managers directness and clarity, seeing it as a sign of respect and professionalism rather than pressure.",1,"dom",5,3,"do",47,4,0,0,0,0,0,0,0,0,5,95,4,4,2,1,6,3,3,1,3,3,1,1,1,52,"white","GED","$140,001-$160,000","woman","Full-time",NA
288,"pos","It gives off a vibe of ok let's go! This can be very motivating and pump someone up giving them positive feelings toward their manager.",0,"nondom",2,2.1,"skip",41,3,0,0,30,40,50,60,70,80,90,100,2,2,1,1,3,2,2,1,2,5,1,1,1,35,"white","MA","$60,001-$80,000","woman","NA",NA
289,"neg","I think that they may have some negative thoughts in the form of doubt that they could not do good. They may also feel some negativity associated with feeling pressure to work harder from the manager.",0,"nondom",1,2.9,"do",43,4,2,4,2,3,6,6,23,41,58,100,4,2,2,4,2,6,1,2,2,4,1,1,1,44,"white","4yearColl","$60,001-$80,000","woman","Full-time","none"
290,"pos","I think they would feel like they are doing a great job and know their expectations.",0,"nondom",1,3,"do",28,7,43,64,42,25,49,73,54,41,33,78,6,2,2,2,2,4,2,6,3,1,1,1,1,25,"white","4yearColl","$60,001-$80,000","woman","Full-time",NA
291,"pos","They will think the manager is encouraging and trying to help them earn as much as they can. They will be appreciative.",1,"dom",6,3,"do",50,7,100,100,100,100,100,100,100,100,100,100,5,3,1,4,1,2,2,1,4,7,1,1,1,56,"white","4yearColl","$0-$20,000","woman","Full-time",NA
293,"neg","I think the employee would think that this would be a negative message to receive because it is kind of threatening. I think they would not like their manager is they were to receive this type of message.",0,"nondom",1,1.4,"skip",28,1,18,30,40,50,60,70,80,85,90,100,4,1,1,1,1,1,1,1,2,1,1,1,1,36,"white","4yearColl","$100,001-$120,000","woman","Full-time",NA
294,"neg","An employee might think that the manager does not appreciate their hard work already.",0,"nondom",1,3.1,"skip",34,2,76,87,93,93,92,93,92,94,93,99,5,2,3,4,3,4,2,4,1,3,1,1,1,21,"hispanic",NA,"$0-$20,000","woman","NANA",NA
296,"pos","i think that the employee could think of this message positively because they would be encouraged by the idea of getting the bonus, therefor it would make them do their best and work hard to achieve that.",0,"nondom",1,1.9,"do",50,5,10,20,30,40,50,60,70,80,90,100,2,1,1,1,1,1,1,1,3,7,1,1,1,29,"white","GED","$80,001-$100,000","woman","Full-time",NA
297,"neg","The employee can feel like the manager is putting too much pressure on them or even threatening them.",0,"nondom",1,3.2,"do",46,5,10,20,30,40,50,60,70,80,88,100,1,4,1,1,6,4,2,5,2,6,1,1,1,45,"black","GED","$20,001-$40,000","man","Full-time",NA
298,"neg","The employee might not care about the bonus or completing the task. The message sounds condescending to the employee.",0,"nondom",2,2.6,"skip",50,3,0,0,0,0,50,50,50,50,50,100,3,5,2,2,3,4,1,2,1,3,1,1,1,54,"white","4yearColl","$80,001-$100,000","man","Full-time",NA
299,"pos","There is a bit of encouragement for the employee about how this task needs to be done. I can see that when the manager says to the employee to do their absolute best.",0,"nondom",1,3.3,"do",45,4,50,50,50,50,50,50,50,50,50,50,2,6,2,2,6,6,2,2,1,4,1,1,1,31,"hispanic","2yearColl","$40,001-$60,000","woman","NA",NA
300,"pos","The words of encouragement to do their best can be seen as positive.",0,"nondom",1,3.1,"skip",25,3,0,10,10,10,10,10,10,10,10,20,3,4,4,4,3,4,2,2,2,3,1,1,1,32,"white","4yearColl","$60,001-$80,000","man","Full-time","None"
301,"pos","They might be a person that could work well under pressure and feel more motived by a  message like this and think the manager is strict but fair.",0,"nondom",1,3.1,"skip",21,2,15,35,39,42,44,50,53,56,84,92,4,4,3,4,3,4,3,1,3,2,1,1,1,24,"white","GED","$40,001-$60,000","man","Full-time",NA
302,"neg","The implied threat of not receiving the full bonus if the employee does not do their best is a sure deterrent towards a positive interaction.  They would consider the manager domineering and believe that the manager doubts their intelligence and work ethic.",0,"nondom",1,2,"do",41,2,49,61,65,72,74,74,75,100,100,100,2,2,1,1,2,2,2,2,3,3,1,1,1,68,"white","GED","$60,001-$80,000","man","Full-time",NA
303,"neg","because it is kind of curt. Like matter of factish not pleasant at all I would feel a certain way being spoken to like that",0,"nondom",1,3.2,"do",43,6,5,10,15,16,25,30,35,40,45,50,5,3,2,2,2,7,1,3,2,5,1,1,1,53,"black","GED","$180,001-$200,000","woman","Full-time","no"
304,"pos","The employee could view the message positively if they think about the reward they will get of the full bonus by working hard .",0,"nondom",2,2.6,"skip",30,2,100,100,100,100,100,100,100,100,100,100,3,3,2,2,2,3,3,2,3,3,1,1,1,38,"multiracial","4yearColl","$20,001-$40,000","man","Full-time",NA
305,"pos","I will do my best and get the job done as I realize how important it is.",0,"nondom",1,2.7,"do",25,7,25,24,25,50,50,50,50,75,75,75,3,4,2,2,3,4,2,2,2,3,1,1,1,56,"white","2yearColl","$180,001-$200,000","woman","NA","none"
306,"neg","If I send that message, the employee will feel pressured to do well and get nervous. If that happens, they might not perform well hence not earn the bonus.",0,"nondom",1,2.6,"do",45,6,10,20,30,40,50,60,70,80,90,100,4,2,1,5,2,4,2,1,2,3,1,1,1,28,"multiracial","MA",NA,"woman","Full-time, Student",NA
307,"pos","The positive thoughts could be the willingness to complete the task that is asked of them and to do their best. They are also reminded about the bonus that they could receive.",0,"nondom",3,2.7,"skip",40,2,55,60,65,70,75,80,85,90,95,100,5,3,1,2,3,5,2,1,2,3,1,1,1,47,"white","4yearColl","Over $200,000","man","Full-time","Thank you for the study."
308,"pos","They understand the task as well as the objective. There is a clear guideline on how to get the entire bonus.",0,"nondom",1,3.2,"skip",28,2,13,17,34,42,50,59,72,81,86,100,4,2,2,2,5,5,2,1,3,6,1,1,1,44,"asian","4yearColl","$100,001-$120,000","man","Full-time",NA
311,"pos","The overall sentiment is fairly uplifting intended to stoke their motivation.  I could imagine pride from having done well being a big motivator as well.",0,"nondom",2,1.8,"do",30,6,100,100,100,100,100,100,100,100,100,100,1,1,1,2,1,1,5,1,3,2,1,1,1,33,"white","4yearColl","$40,001-$60,000","man","NA",NA
312,"pos","I think the employee could feel encouraged by the manager telling them to do their absolute best across all the rounds. It also fosters a working relationship between the manager and employee, where the employee's performance correlates to the bonus they receive.",0,"nondom",2,2.1,"do",50,2,0,0,0,0,0,100,100,100,100,100,3,2,2,2,2,3,1,1,3,2,1,1,1,24,"white","4yearColl","$20,001-$40,000","man","Full-time",NA
313,"neg","This isn't encouraging. It sounds threatening, and likely wouldn't encourage the employee or make them feel like a team member.",0,"nondom",1,2.2,"do",35,3,20,30,30,30,40,50,60,75,90,100,2,2,2,1,2,5,2,1,3,2,1,1,1,58,"white","4yearColl","$160,001-$180,000","woman","Full-time",NA
314,"pos","They may be thankful you are letting them know the bonus depends on it.  They will want to get a good bonus",0,"nondom",1,2.5,"do",35,5,0,100,100,100,100,100,100,100,100,100,3,2,3,3,2,3,2,2,2,3,1,1,1,42,"white","4yearColl","$60,001-$80,000","man","Full-time",NA
315,"pos","It is encouraging and lets them know that I think the employees are capable. And by putting in there that there is a bonus on the line, that helps to motivate",1,"dom",5,2.7,"do",40,3,40,50,60,70,80,90,95,95,100,100,3,5,2,2,1,6,1,2,3,2,1,1,1,NA,"white","PHD","$60,001-$80,000","woman","Full-time",NA
316,"pos","The only positive aspect I get from this prompt is that it seems to push you to do your best; it seems encouraging.",0,"nondom",1,2.6,"skip",33,3,14,21,28,35,42,47,67,73,80,100,3,3,2,3,2,3,2,3,2,3,1,1,1,32,"multiracial","GED","$40,001-$60,000","woman","Full-time",NA
317,"neg","In this kind of scenario you want to avoid  pressure, but the manager seems to not consider that an dis focused on the bonus more than the employee
",0,"nondom",1,3.7,"do",35,6,80,80,81,79,68,66,63,59,58,56,6,2,6,1,4,6,2,6,2,2,1,1,1,51,"multiracial","4yearColl","$100,001-$120,000","woman","Full-time",NA
318,"neg","The employee could feel threatened by the language used in an “or else” capacity. As in, you WILL do a great job or else you will NOT receive the bonus. It lacks encouragement, and also incites fear in the employee.",0,"nondom",1,3.3,"skip",37,2,100,100,100,100,100,100,100,100,100,100,5,3,2,4,2,5,2,2,5,3,1,1,1,27,"white","4yearColl","$60,001-$80,000","woman","Full-time","I think that it is better to rule with a gentle hand than an iron fist in any scenario."
319,"pos","It's time to get in there and do the absolute best across all rounds. This is a very enclosed statement, letting the employee know that they have an opportunity to put forth their best efforts to succeed.",0,"nondom",1,1.7,"do",40,3,8,14,16,15,17,42,45,54,75,100,1,1,1,1,2,4,1,1,1,4,1,1,1,54,"black","4yearColl","$80,001-$100,000","man","Full-time",NA
320,"pos","I think the message could have a positive reaction to the message because they would appreciate knowing they might not get a full bonus if they don't complete the task. I think the message may also come across as trying to build them up, which they might appreciate.",0,"nondom",2,2.1,"do",47,5,25,50,50,75,75,100,100,100,100,100,4,2,3,1,1,1,1,1,4,3,1,1,1,41,"white","2yearColl","$0-$20,000","woman","NA",NA
321,"pos","The manager is upfront about the situation and there will be no surprises. One could also imply that if the employee completes the task and does it well, they will get a full bonus.",0,"nondom",2,2.7,"do",45,3,10,10,30,50,70,80,85,90,95,100,4,3,3,1,2,5,2,1,2,4,1,1,1,32,"black","4yearColl","$100,001-$120,000","man","Full-time",NA
322,"neg","They might think that the manager expects perfection which is hard for even the most talented people to do.  It also might think the manager is looking for way to not give them the bonus.",0,"nondom",1,2.2,"do",34,2,5,8,14,25,47,60,72,91,95,100,3,2,3,2,1,4,3,1,2,1,1,1,1,48,"white","4yearColl","$80,001-$100,000","man","Full-time",NA
323,"neg","It is threatening.  I would probably react badly to it.",0,"nondom",1,1.9,"skip",20,2,25,25,25,25,30,30,30,40,40,75,1,1,1,7,1,1,1,1,1,4,1,1,1,70,"white","4yearColl","$60,001-$80,000","woman","Full-time",NA
324,"neg","This message feels very impersonal and an employee may catch on to that. It feels threatening and does not seem like the employee is valued.",0,"nondom",1,2,"do",41,2,17,39,56,65,72,78,83,90,95,100,3,1,2,1,1,3,2,2,3,2,1,1,1,26,"white","4yearColl","$80,001-$100,000","man","Full-time",NA
325,"pos","The employee can feel like the manager would have faith in them in their abilities to complete tasks.",0,"nondom",1,1.6,"skip",40,4,0,5,20,35,55,60,75,80,95,100,1,1,1,1,1,6,1,1,1,2,1,1,1,31,"black","4yearColl","$20,001-$40,000","woman","Full-time",NA
326,"neg","The employee might feel the manager is being pushy or doesn't trust them, which could make them less motivated or annoyed.",1,"dom",5,2.7,"do",30,3,5,5,10,25,30,39,47,61,61,76,5,3,1,2,2,3,3,1,4,3,1,1,1,27,"white","GED","$40,001-$60,000","man","Full-time",NA
327,"pos","They might feel that their manager is concerned about their bonus and trying to push them to do well. They might take the push as positive encouragement and get energized from the motivation. They will feel that the manager cares about their success.",1,"dom",4,2.5,"do",50,3,30,40,50,50,60,80,80,90,95,100,5,1,2,3,2,5,1,1,2,3,1,1,1,30,"white","2yearColl","$40,001-$60,000","woman","Full-time",NA
328,"pos","It's possible that the employee might see the use of the phrase ""do your absolute best"" as encouragement.  Beyond that I don't think an employee would react positively to this message.",0,"nondom",1,3.2,"skip",25,2,10,20,30,40,50,60,70,80,90,100,5,2,1,4,7,2,4,1,2,4,1,1,1,61,"white","4yearColl","Over $200,000","woman","Full-time",NA
329,"neg","It sounds vaguely threatening that you would withhold pay based on performance. Working under that type of pressure is quite negative.",0,"nondom",1,2,"do",35,2,75,75,75,75,75,100,100,100,100,100,2,2,2,2,2,2,2,2,2,2,1,1,1,52,"white","PHD","Over $200,000","woman","Full-time",NA
330,"neg","The employee might feel pressured or threated by the tone of the message interpreting its as controlling or overly demanding this could lead to resentment or reduced motivation as it suggests the manager is more focused on performance and bonces than on mutual respect",0,"nondom",1,2.1,"do",14,3,0,20,40,70,17,82,21,50,77,75,2,2,1,5,1,2,2,1,3,2,1,1,1,54,"white","4yearColl","$40,001-$60,000","woman","Full-time",NA
