"PID","Status","Progress","Duration..in.seconds.","Finished","consent","intro","cond_pos","cond_neg","message_choice","choice_dom","choice_nondom","comp_dom_1","comp_nondom_1","attitude_dom","attitude_nondom","preference","keep_1","keep_2","keep_3","keep_4","keep_5","keep_6","keep_7","keep_8","keep_9","keep_10","CWV_1","CWV_2","CWV_3","CWV_4","CWV_5","CWV_6","CWV_7","CWV_8","CWV_9","CWV_10","check_1","check_2","age","gender_.99_TEXT","race_5_TEXT","feedback","cond","cond_word","cond_word1","Employment_1","Employment_2","Employment_3","Employment_4","Employment_5","Employment_6","Employment_7","Employment_8","Employment_9","gender","race_1","race_2","race_3","race_4","race_5","race_6","income","edu"
219,"0","100","328","1","1","4","","It may make them resent the manager or not work to the fullest capability.","2","","1","","50","","5","6","1","3","5","7","7","7","5","5","6","100","5","3","2","2","6","2","6","1","6","2","5","blue","39","","mixed","","neg","negatively","negative","Full-time","","","","","","","","","man","","","white","hispanic",NA,"","$20,001-$40,000","GED"
220,"0","100","409","1","1","4","","You are using a stick instead of a carrot. I think people would rather be praised/encouraged rather than threatened.","2","","1","","40","","2","5","100","100","100","100","100","100","100","100","100","100","5","3","2","3","6","5","7","1","6","6","5","Aquamarine","46","","","","neg","negatively","negative","Full-time","","","","","","","","","man","","","white","","","","Over $200,000","2yearColl"
221,"0","100","595","1","1","4","They may feel positive that the manager has faith in the fact that they are well aware and capable of the task.  They may also like the encouragement to go ahead and do their best.","","2","","2","","35","","3","5","10","10","10","10","10","10","10","10","10","10","5","4","1","1","6","4","5","2","5","3","5","blue","46","","","","pos","positively","positive","","Part-time","","","","","","","","woman","","","white","","","","$160,001-$180,000","4yearColl"
222,"0","100","602","1","1","4","","It assumes the employee knows the task already. Message sounds more demanding than encouraging.","2","","1","","50","","3","5","10","20","30","40","50","60","70","80","90","100","5","7","1","2","5","5","6","1","5","5","5","Blue","27","","","","neg","negatively","negative","Full-time","","","","","","","","","man","","","white","","","","$140,001-$160,000","4yearColl"
223,"0","100","672","1","1","4","","the message is kind of negative, so a negative response wouldn't be odd to me. I think it's basically a threat and not motivating them at all","2","","2","","25","","2","6","7","11","17","23","30","40","49","57","69","100","5","6","1","1","6","5","7","1","6","2","5","purple","30","","","","neg","negatively","negative","Full-time","","","","","","","","","woman","","","white","","","","$180,001-$200,000","4yearColl"
224,"0","100","621","1","1","4","","The tone of the sentences seem condescending therefore could be discouraging ","2","","2","","28","","2","6","3","13","27","38","47","59","63","76","84","100","5","6","2","1","5","2","7","1","5","5","5","Green","37","","","","neg","negatively","negative","","","Temporarily laid off","","","","","","","woman","asian","","","","","","Over $200,000","4yearColl"
225,"0","100","506","1","1","4","This message sounds most personally supportive. They know the task and and are psyching them up, not demanding. ","","1","1","","35","","5","","6","10","27","50","50","73","85","85","95","100","100","2","7","1","2","7","1","6","1","4","4","5","bluegreen","40","","","","pos","positively","positive","Full-time","","","","","","","","","woman","","","white","","","","$60,001-$80,000","4yearColl"
226,"0","100","421","1","1","4","If the employee has a competitive nature, asking them to do their absolute best may activate that motivation. The phrase ""It's time to get in there"" sounds very much like something a high school sports coach would say, and I feel like this would encourage the employee to see you as their coach.","","2","","1","","25","","3","5","50","100","100","100","100","100","100","100","100","100","2","7","5","2","7","5","7","1","5","7","5","pink","36","","","","pos","positively","positive","","Part-time","","","","","","","","woman","","","white","","","","$0-$20,000","MA"
227,"0","100","391","1","1","4","","This message is not encouraging and comes across as a threat.  If you don't do it, you will not get the full bonus.  It is not at all warm or friendly.  ","2","","2","","36","","2","6","50","50","75","100","100","100","100","100","100","100","2","6","2","1","6","2","6","1","5","3","5","blue","48","","","","neg","negatively","negative","","Part-time","","","","","","","","woman","","","white","","","","$160,001-$180,000","GED"
228,"0","100","359","1","1","4","","The message is using the threat of not getting a bonus to try to inspire the person to do well. Not everyone responds well to threats, so it can be viewed very negatively.","2","","2","","30","","1","6","19","29","40","50","60","70","75","80","90","100","2","2","2","2","6","2","7","2","6","6","5","black","48","","","","neg","negatively","negative","Full-time","","","","","","","","","man","","","white","","","","$140,001-$160,000","4yearColl"
229,"0","100","719","1","1","4","I believe it is implied in the message should the employee did a good job he will get a full bonus. So that's the positive thing he will take from the message.","","2","","2","","36","","2","6","5","10","15","20","25","30","35","40","45","50","5","4","2","4","5","5","6","2","6","5","5","red","32","","","I have none.","pos","positively","positive","Full-time","","","","","","","","","man","","black","","","","","$160,001-$180,000","4yearColl"
230,"0","100","554","1","1","4","","'Do your absolute best' may put unwanted pressure on the employee. There's also a difference between completing something and doing it well, the latter being an additional factor for the employed to worry about. I'd wager the employee might worry more about doing well than completing the task, feeling their manager only cares about what looks best and not the pressure their employee feels.","2","","1","","40","","3","5","11","15","27","35","51","68","70","85","90","100","1","7","1","1","7","1","6","1","5","4","5","Verdant green","28","","","","neg","negatively","negative","Full-time","","","","","","","","","woman","","","white","","","","$0-$20,000","4yearColl"
231,"0","100","927","1","1","4","I feel that adding the ""if you don't"" part gives off a negative emotion. You want to encourage not scare. ","","2","","1","","50","","7","6","0","0","0","10","15","25","40","60","80","100","7","3","6","5","2","5","4","1","3","4","5","Purple","21","","","","pos","positively","positive","","Part-time","","","","","","","","man","","black","","","","","$0-$20,000","GED"
232,"0","100","773","1","1","4","","It seems a little demanding and could cause the employee to no longer want to complete the task. “get in there and do your absolute best across all round” isn’t encouraging but demanding. ","2","","2","","35","","2","6","60","75","75","80","80","85","85","90","95","100","5","6","2","1","7","5","7","1","7","5","5","Blue","36","","","","neg","negatively","negative","Full-time","","","","","","","","","woman","","black","","","","","$40,001-$60,000","2yearColl"
233,"0","100","660","1","1","4","I think the whole message is positive.  The last part may throw some pressure but it is not saying they will fail.  I think if i received this message it would be clear and to the point. ","","1","1","","40","","5","","5","100","100","100","100","100","100","100","100","100","100","5","5","1","2","5","5","7","1","6","3","5","Red","45","","","","pos","positively","positive","Full-time","","","","","","","","","man","","","white","","","","$160,001-$180,000","2yearColl"
234,"0","100","581","1","1","4","","This message might make the employee feel pressured and controlled, seeing the manager as demanding and unsupportive rather than encouraging, which could damage trust. They might feel their autonomy is being undermined, leading to resentment or a perception that the manager is only focused on their own bonus.


","2","","1","","30","","2","6","10","20","30","40","50","60","70","80","89","100","1","7","1","1","6","1","7","1","7","6","1","green","25","","","","neg","negatively","negative","Full-time","","","","","","","","","man","","black","","","","","$160,001-$180,000","4yearColl"
235,"0","100","277","1","1","4","","The employee could interpret this message as demoralizing and demanding. It leaves little to no room for human error, which can be frustrating!","2","","1","","50","","5","6","50","50","50","50","50","100","100","100","100","100","1","7","1","1","7","1","7","1","6","6","5","Blue","37","","","N/A","neg","negatively","negative","","Part-time","","","","","","","","woman","","","white","","","","$80,001-$100,000","4yearColl"
236,"0","100","755","1","1","4","","the employee might feel like i am badgering them to do the task. they may also feel like i am not being supportive in a positive and encouraging way.","2","","2","","10","","1","6","10","20","30","40","50","60","70","80","90","100","5","6","1","1","6","6","6","2","6","5","5","Blue","46","","","","neg","negatively","negative","Full-time","","","","","","","","","woman","","black","","hispanic","","","$100,001-$120,000","4yearColl"
237,"0","100","350","1","1","4","","The employee can have a negative reaction due to this message containing more negative tone. It puts more weight on the employee as it brings in the fact that they will not get the complete bonus if they dont do a good job. ","2","","1","","46","","6","6","5","5","10","10","20","25","25","50","50","50","3","5","3","3","6","5","5","1","5","5","5","teal","29","","","","neg","negatively","negative","Full-time","","","","","","","","","woman","asian","","","","","","$40,001-$60,000","4yearColl"
238,"0","100","312","1","1","4","","They feel like their being pressured to perform well, if not they won't be getting a bonus. It feels forced.","2","","2","","37","","3","5","12","29","33","41","45","57","72","83","94","100","2","6","2","2","7","3","3","1","6","4","5","blue","35","","","","neg","negatively","negative","Full-time","","","","","","","","","woman","asian","","","","","","$100,001-$120,000","2yearColl"
239,"0","100","267","1","1","4","","I think it is pretty negative when it states ""if you dont complete it and do well, you will not get the full bonus""","2","","1","","40","","6","6","100","100","100","100","100","100","100","100","100","100","2","6","2","2","6","2","7","1","6","5","5","blue","31","","","","neg","negatively","negative","Full-time","","","","","","","","","woman","","","white","","","","Over $200,000","MA"
240,"0","100","612","1","1","4","The message seems energized and exciting. It is encouraging in a way that may pump up the person and encourage them to do well at the task. ","","1","1","","50","","6","","6","100","100","100","100","100","100","100","100","100","100","3","6","1","1","7","4","7","2","7","4","5","Green","37","","","","pos","positively","positive","Full-time","","","","","","","","","woman","","","white","","","","$100,001-$120,000","GED"
241,"0","100","209","1","1","4","They would be motivated to do well. If they do well and get rewarded they will appreciate their manager.","","1","1","","50","","6","","5","17","39","61","80","100","100","100","100","100","100","6","4","3","3","6","6","6","2","2","4","5","blue","42","","","","pos","positively","positive","Full-time","","","","","","","","","man","","","","","","Click to write Choice 7","$100,001-$120,000","PHD"
242,"0","100","778","1","1","4","My manager thinks I can do my best. They want me to succeed so I will get my bonus.","","1","1","","31","","6","","5","10","20","29","40","54","59","70","79","91","100","2","6","2","2","7","4","5","1","5","4","5","green","41","","","","pos","positively","positive","Full-time","","","","","","","","","woman","","","white","","","","$60,001-$80,000","GED"
243,"0","100","1049","1","1","4","The employee might appreciate the manager's directness and clarity. understanding that the message shows the manager has high expectation and believes they are capable of doing well.","","2","","1","","41","","5","5","33","42","52","55","58","64","67","66","70","72","4","5","7","6","7","5","2","5","7","5","5","Yellow","33","","","Thanks for the opportunity","pos","positively","positive","Full-time","","","","","","","","","man","","","white","","","","$40,001-$60,000","4yearColl"
244,"0","100","433","1","1","4","The employee may see this message as positive because the manager is suggesting that the employee typically does a great job and that on this task it should be no different. ","","2","","1","","40","","3","6","0","10","20","30","40","50","60","70","90","100","6","5","2","6","6","6","7","5","6","5","5","Black","27","","","","pos","positively","positive","Full-time","","","","","","","","","man","","black","","hispanic","","","$160,001-$180,000","PHD"
245,"0","100","318","1","1","4","They are assuming they know the task at hand and don't need a refresher. It also also fairly curt in the delivery.","","2","","2","","15","","2","6","100","100","100","100","100","89","86","85","81","78","2","1","1","1","7","1","6","1","6","6","5","Gray","43","","","","pos","positively","positive","Full-time","","","","","","","","","man","","","white","","","","$180,001-$200,000","GED"
246,"0","100","535","1","1","4","","The employee might feel micromanaged, pressured, or threatened by the message, perceiving it as a lack of trust in their abilities.","2","","1","","37","","6","6","66","88","82","67","66","66","78","69","75","70","6","6","5","5","5","6","5","6","6","5","5","blue","24","","","","neg","negatively","negative","","Part-time","","","","","","","","man","","black","","","","","$40,001-$60,000","4yearColl"
247,"0","100","522","1","1","4","","Well.. ..To say the least, this particular messaging is Patronizing.  And, controlling.  

That, I make it sound like I'm the one who's determining my employee's fate, also, doesn't help matters.","2","","2","","0","","1","6","0","21","30","40","50","60","70","80","90","100","4","7","2","2","7","4","7","2","6","4","5","Sapphire Blue","43","","","i think i'd rather have worked on the shape-picker task. :-).","neg","negatively","negative","Full-time","","","","","","","","","man","","black","","","","","$20,001-$40,000","GED"
248,"0","100","677","1","1","4","The employee might feel respected and trusted by their manager, believing that their efforts are appreciated and the manager genuinely cares about their success. This positive perception can cultivate loyalty and a stronger sense of commitment to preforming at their best.","","1","1","","37","","6","","6","55","61","73","52","65","48","55","49","50","61","5","5","6","5","6","6","4","5","7","5","5","yellow","58","","","","pos","positively","positive","Full-time","","","","","","","","","man","","black","","","","","$60,001-$80,000","4yearColl"
249,"0","100","453","1","1","4","","the message sounds very aggressive and confrontational ","2","","1","","35","","2","6","11","23","33","43","54","64","72","81","91","100","5","3","5","5","6","6","6","1","3","6","5","green","44","","","","neg","negatively","negative","Full-time","","","","","","","","","man","","","white","","","","$80,001-$100,000","4yearColl"
250,"0","100","930","1","1","4","The employee might appreciate the directness and clear expectations from the manager, valuing the manager's honesty about the bonus being tied to performance. This could foster a sense of trust and transparency in their professional relationship.","","2","","1","","30","","2","6","4","10","20","30","40","50","60","71","80","100","6","6","6","2","6","6","6","2","6","6","5","black","44","","","","pos","positively","positive","Full-time","","","","","","","","","man","","","white","","","","$100,001-$120,000","4yearColl"
251,"0","100","289","1","1","4","The manager acknowledges that the employee has an understanding of the task.  This will make the employee feel intelligent and is positive.","","1","1","","30","","6","","5","14","25","35","46","57","70","85","94","97","100","2","5","1","1","7","2","7","1","6","5","5","blue","54","","","","pos","positively","positive","Full-time","","","","","","","","","man","","","white","","","","Over $200,000","4yearColl"
252,"0","100","278","1","1","4","","It says the statement ""if you don't complete it and do it well"" and then lists a consequence, you will not get the full bonus. It is concentrating on all negative things. ","2","","2","","40","","3","6","100","100","100","100","100","100","100","100","100","100","5","5","5","3","5","5","5","5","5","5","5","black","34","","","","neg","negatively","negative","Full-time","","","","","","","","","woman","","","white","","","","$140,001-$160,000","4yearColl"
253,"0","100","490","1","1","4","","The employee would likely have a negative perception of me if I chose to send this message because it comes off as strict and demeaning. I would not choose this message because it expects a lot from a stranger, and I think they would not care about me or the task at hand because they would see the situation as not that serious then perform poorly. ","2","","1","","40","","5","6","0","5","10","20","30","40","50","70","85","100","3","5","6","2","6","5","5","1","5","5","5","Orange","33","","","","neg","negatively","negative","","Part-time","","","","","","","","man","","","white","","","","$0-$20,000","GED"
254,"0","100","453","1","1","4","The manager has a friendly demeanor and seems to want me to reach my full potential. ","","2","","1","","36","","5","5","0","0","0","0","74","0","74","0","0","100","2","6","2","1","7","2","6","2","5","5","5","blue","","","","","pos","positively","positive","","Part-time","","","","","","","","woman","","","white","","","","$100,001-$120,000","4yearColl"
255,"0","100","566","1","1","4","","The employee might feel as though you have little confidence in their integrity and work ethic and therefore feel the need to threaten them with their bonus to make them perform their work adequately. ","1","1","","50","","4","","6","0","10","15","20","25","30","35","40","45","100","5","4","2","2","5","5","6","2","3","4","5","black","47","","","none","neg","negatively","negative","Full-time","","","","","","","","","man","","","white","","","","$160,001-$180,000","4yearColl"
256,"0","100","498","1","1","4","They might act positively to this thinking that they need to work really hard to get the bonus and they know up front what needs to be done and what's expected. So it's pretty transparent that the better they do the more bonus that they'll receive.","","2","","1","","50","","2","6","20","30","40","50","60","70","80","90","95","100","6","7","3","2","7","2","5","2","1","6","5","green","57","","","","pos","positively","positive","Full-time","","","","","","","","","man","","","white","","","","$20,001-$40,000","4yearColl"
257,"0","100","451","1","1","4","It does insinuate that you are capable of doing the project well enough for the full bonus. It also clearly lays out why you should pay attention to the assignment.","","2","","1","","40","","3","6","62","68","74","77","81","84","90","93","98","100","2","5","2","2","5","2","6","2","6","5","5","Blue","","","","","pos","positively","positive","Full-time","","","","","","","","","woman","","","white","","","","$120,001-$140,000","MA"
258,"0","100","1087","1","1","4","The employee might have a positive impact or reaction to the message above only by knowing that the manager would want the absolute best for them. Also, knowing that the manager is a no-nonsense manager and frowns on failure would serve as a motivation.","","2","","2","","20","","3","6","45","45","45","45","50","56","70","100","100","100","7","7","6","6","3","5","7","5","3","2","5","Blue","26","","","","pos","positively","positive","Full-time","","","","","","","","","man","","black","","","","","$140,001-$160,000","4yearColl"
259,"0","100","903","1","1","4","","The message comes off demanding and cold, if I were the employee this would not motivate me to do well.","2","","1","","10","","2","6","10","20","30","40","50","60","70","80","90","100","5","3","1","1","7","6","6","1","7","6","5","orange","27","","","","neg","negatively","negative","","Part-time","","","","","","","","man","","","white","","","","$80,001-$100,000","GED"
260,"0","100","577","1","1","4","","They might think this message is very demanding and will react by thinking negatively towards the manager because he seems overbearing and stern. ","2","","1","","36","","3","6","7","17","28","40","53","65","75","86","94","100","3","7","2","2","6","3","7","1","6","5","5","Green","63","","","","neg","negatively","negative","Full-time","","","","","","","","","man","","","white","","","","$20,001-$40,000","2yearColl"
261,"0","100","398","1","1","4","They'll reach positively because I'm giving them words of encouragement and advice to do well. I win if they win. ","","1","1","","49","","6","","6","15","30","44","61","75","75","100","100","100","100","4","6","1","2","6","5","6","1","6","6","5","Red","32","","Middle Eastern ","","pos","positively","positive","Full-time","","","","","","","","","woman","","","","",NA,"","$40,001-$60,000","4yearColl"
262,"0","100","343","1","1","4","The employee might appreciate the mangers honesty and clear expectation, which can foster trust and motivate them to perform their best. They may also feel valued through direct communication, strengthening their respect for the manager.","","2","","1","","29","","6","6","5","20","40","54","54","58","62","65","72","78","2","6","1","1","6","5","6","4","6","6","5","blue","39","","","","pos","positively","positive","Full-time","","","","","","","","","man","","","white","","","","$100,001-$120,000","4yearColl"
263,"0","100","882","1","1","4","","The employee might feel pressured or micromanaged, interpreting the message as demanding and unsupportive. this could lead them to view the manager as more focused on their own bonus than on encouraging mutual success.","2","","1","","37","","5","6","13","20","29","37","43","50","58","64","72","82","4","5","5","6","6","5","4","5","7","5","5","Yellow","45","","","Great survey, Thanks!","neg","negatively","negative","Full-time","","","","","","","","","man","","","white","","","","$60,001-$80,000","4yearColl"
264,"0","100","764","1","1","4","They could be happy that the boss is encouraging to their best and use that as a motivator","","1","1","","45","","5","","5","44","56","66","66","56","69","67","62","76","52","5","4","4","4","4","5","5","5","4","5","5","purple","27","","","nope","pos","positively","positive","Full-time","","","","","","","","","woman","","black","","","","","$40,001-$60,000","2yearColl"
265,"0","100","720","1","1","4","Even though it's hard to imagine getting a positive reaction to this message, maybe this kind of message could make a person feel more determined, and be grateful to the manager for being straightforward and honest about his expectations and the consequences of failing. ","","2","","2","","40","","2","6","10","30","40","50","50","70","80","90","100","100","2","6","1","2","7","2","7","1","6","5","5","Blue","30","","","","pos","positively","positive","","Part-time","","","","","","","","woman","","","white","","","","$40,001-$60,000","MA"
266,"0","100","892","1","1","4","i guess they would need to see this as tough love. this is rather factual rather than positive","","2","","2","","5","","3","6","100","100","100","100","100","100","100","100","100","100","5","5","1","2","5","3","5","2","5","5","5","green","59","","","","pos","positively","positive","","Part-time","","","","","","","","woman","","","white","","","","$20,001-$40,000","4yearColl"
267,"0","100","627","1","1","4","","They might be worried about not receiving a bonus despite their best efforts ","2","","1","","30","","4","4","3","13","18","30","38","46","61","70","85","100","5","5","1","3","5","4","6","3","6","3","5","Red","32","","","","neg","negatively","negative","Full-time","","","","","","","","","man","","","white","","","","$20,001-$40,000","4yearColl"
268,"0","100","523","1","1","4","","It shows that their bonus is only contingent on this particular task. It does not look at the employee as a whole and their efforts in their day-to-day job. ","2","","1","","40","","2","5","100","100","100","100","100","100","100","100","100","100","3","5","2","2","6","2","5","2","4","5","5","blue","38","","","","neg","negatively","negative","Full-time","","","","","","","","","woman","","","white","","","","$80,001-$100,000","4yearColl"
269,"0","100","571","1","1","4","","The second sentence is framed with a negative outcome (""you will not get the full bonus"").  This may discourage the employee. It would be better to make a positive statement of the results of doing well.","2","","1","","35","","3","5","10","20","70","75","80","92","94","96","98","100","1","6","2","2","7","1","6","1","6","6","5","blue","63","","","none","neg","negatively","negative","Full-time","","","","","","","","","man","","","white","","","","$100,001-$120,000","MA"
270,"0","100","417","1","1","4","","I think the above message is suggesting that the employee doesn’t normally do their best work. I would find it a little insulting. The message doesn’t sound very trusting of the employee","2","","2","","45","","2","5","100","100","100","100","100","100","100","100","100","100","2","6","1","1","7","2","7","1","6","6","5","Green ","44","","","","neg","negatively","negative","Full-time","","","","","","","","","woman","","","white","","","","$100,001-$120,000","4yearColl"
