"PID","cond","reflection","choicedom","message_choice","pref_cont","CWV","pred_choice","pred_comp","pred_att","keep_1","keep_2","keep_3","keep_4","keep_5","keep_6","keep_7","keep_8","keep_9","keep_10","CWV_1","CWV_2R","CWV_3","CWV_4","CWV_5R","CWV_6","CWV_7R","CWV_8","CWV_9R","CWV_10R","att_1","att_2","is_elg","age","race","edu","income","gender","employment","feedback"
166,"neg","I can see it being negative, because of the pressure of not receiving a bonus if they don't complete the task. I think if the employees are more relax they won't be too stress to reach an acceptable outcome.",0,"nondom",3,2.8,"do",35,3,100,100,100,100,100,100,100,100,100,51,5,5,2,2,1,5,2,1,2,3,1,1,1,42,"asian","2yearColl","$100,001-$120,000","man","Full-time",NA
167,"pos","It explains the consequences and tries to get the employee excited about it. It encourages to win the bonus.",0,"nondom",2,1.8,"do",39,5,0,5,10,25,30,50,55,60,65,100,3,1,1,2,1,1,2,1,3,3,1,1,1,47,"white","GED","$60,001-$80,000","woman","NA","Thank you"
168,"neg","there is an explicit negative threat that would offend many workers",0,"nondom",1,3.1,"skip",0,2,10,20,30,40,50,60,70,80,90,100,3,3,3,3,3,3,3,3,3,4,1,1,1,58,"white","4yearColl","$40,001-$60,000","man","Full-time",NA
169,"pos","This message is straight to the point. There is no interpretation needed so exmployees might know exactly what the point of the task is and what is at stake",0,"nondom",2,2.4,"do",41,5,0,10,20,30,40,50,60,70,80,100,5,2,1,1,1,4,2,1,4,3,1,1,1,28,"white","MA","$100,001-$120,000","woman","NANA",NA
170,"pos","The pressure to absolutely do your best and not accept any other outcomes creates a sense of unnecessary pressure on the employee to not make any mistakes. Mistakes are how we learn and grow, and to try to create a culture that avoids that is not conductive towards growth and development.",0,"nondom",3,2.7,"do",41,2,20,31,40,51,59,69,79,86,92,100,6,1,3,5,1,3,1,3,2,2,1,1,1,32,"other","4yearColl","$140,001-$160,000","man","Full-time",NA
171,"neg","If I were an employee a message like this world actually discourage me, I'd feel pressured\uncomfortable about performing by my manager.",0,"nondom",1,2.1,"skip",40,3,10,20,30,40,50,60,70,80,90,100,3,2,1,2,1,3,1,2,3,3,1,1,1,60,"white","4yearColl","$100,001-$120,000","man","Full-time",NA
172,"neg","The employee might feel that I was telling them to do well even if they are not going to get a bonus.  They might feel as though they are being cheated.",0,"nondom",2,1.7,"skip",40,2,9,10,11,12,20,20,30,40,40,50,2,3,1,3,1,3,1,1,1,1,1,1,1,77,"white","PHD","$120,001-$140,000","man","NA",NA
173,"pos","They may feel positive about the potential for getting the full bonus. They may feel like there is a no nonsense approach from the manager.",0,"nondom",1,1.7,"do",30,3,20,20,20,20,90,90,100,100,100,100,1,2,1,1,1,3,2,1,3,2,1,1,1,35,"white","4yearColl","$160,001-$180,000","man","Full-time",NA
174,"pos","I do not think the message the manage sent was a very encouraging one. I feel that the employee will be a bit taken aback by it's gruff nature. The only good thing I think might come out of this is the manager might want the employee to be fired up and really want to impress the employer",0,"nondom",1,1.7,"do",25,1,5,10,15,20,25,30,35,40,45,50,1,1,1,1,1,4,1,1,2,4,1,1,1,59,"white","2yearColl","$60,001-$80,000","woman","Full-time",NA
175,"pos","The employee would have a negative reaction to this message because it would put him/her under pressure.",0,"nondom",1,4.3,"skip",19,1,25,41,46,53,68,81,92,93,92,97,3,6,3,3,5,3,6,3,6,5,1,1,1,33,"black","4yearColl","$120,001-$140,000","woman","Full-time","why was I asked for my favorite color"
176,"pos","The employee would have a positive reaction to the message because they want to get into the task and get a full bonus.",0,"nondom",1,3.3,"do",50,7,5,10,15,20,25,30,35,40,45,50,5,4,4,2,3,5,3,2,2,3,1,1,1,42,"white","GED","$140,001-$160,000","man","Full-time",NA
177,"neg","This message focuses on the negative and is very severe-sounding.",0,"nondom",1,2.1,"do",26,5,100,100,100,100,100,100,100,100,100,100,3,2,1,1,2,3,2,1,3,3,1,1,1,42,"white","2yearColl","$100,001-$120,000","man","Full-time",NA
178,"neg","It’s time to get in there and do your absolute best can be worded “ try to do your best so you can get the full bonus! “  the original sentence isn’t very enthusiastic or doesn’t get me excited about the bonus.",0,"nondom",2,2.3,"do",35,3,5,10,15,20,25,35,45,65,75,100,5,3,1,1,2,3,2,1,2,3,1,1,1,52,"white","2yearColl","$40,001-$60,000","woman","NA",NA
180,"pos","The employ would be positively motivated so they could work hard for the bonus knowing it was on the line.  It also positively motivates them by telling them they already understand the task.",0,"nondom",1,1.8,"do",30,3,5,12,22,32,42,52,62,80,90,100,2,7,1,1,2,1,1,1,1,1,1,1,1,43,"white","4yearColl","$40,001-$60,000","man","NA",NA
181,"neg","It has a feel of being very cold and direct. It will give the employee the feeling of being left alone without the managers support.",0,"nondom",1,2.6,"skip",25,1,5,20,30,40,50,60,70,80,90,100,5,3,1,2,2,5,1,1,2,4,1,1,1,51,"white","2yearColl","$140,001-$160,000","man","Full-time","Not applicable"
182,"neg","It seems very straightforward, but it could also come across as cold which could make the employee feel under pressure.",0,"nondom",1,1.8,"do",41,6,25,25,30,50,75,75,100,100,100,100,1,2,1,1,3,4,1,1,2,2,1,1,1,24,"white","GED","$80,001-$100,000","woman","Full-time",NA
183,"neg","It sounds like a threat so everyone has negative thought about it.",0,"nondom",1,3,"skip",28,2,39,50,44,46,47,54,60,60,60,60,2,3,4,2,2,5,3,2,3,4,1,1,1,27,"black","4yearColl","$40,001-$60,000","man","Full-time",NA
184,"neg","They might have a negative attitude towards the manager because it sounds aggressive and not supportive at all. It sounds as if an ultimatum is being given.",0,"nondom",1,3.1,"skip",15,1,0,10,15,20,25,30,35,40,45,50,4,3,1,2,2,4,4,1,4,6,1,1,1,41,"hispanic","4yearColl","$60,001-$80,000","woman","Full-time",NA
185,"pos","Let's do our best and go for the best bonus we can and share it with the entire group",0,"nondom",2,2.6,"do",45,6,100,100,100,100,100,100,100,100,100,100,4,3,2,3,2,3,2,2,2,3,1,1,1,32,"asian","4yearColl","Over $200,000","man","Full-time",NA
186,"neg","They might think I am being too harsh and only focused on the result and not how they're feeling. They could also feel like i don't trust them enough to do their work well",0,"nondom",2,3.4,"do",35,4,100,90,75,65,85,76,79,73,79,88,2,4,5,6,1,7,2,4,1,2,1,1,1,28,"white","4yearColl","$60,001-$80,000","woman","NA",NA
187,"pos","The manager is encouraging and wants me to get the highest bonus possible.",1,"dom",5,2,"do",47,6,0,5,10,16,20,28,32,50,72,92,3,3,1,1,2,2,2,1,2,3,1,1,1,67,"white","4yearColl","$60,001-$80,000","man","NANA",NA
188,"pos","The employee might feel positively because the manager is emphasizing the possibility of a bonus, and not basing doing well on something unrelated to financial gain.",1,"dom",5,2.1,"do",48,5,100,100,100,100,100,100,100,100,100,100,1,1,1,2,2,1,2,1,5,5,1,1,1,25,"white","GED","Over $200,000","woman","Full-time",NA
189,"pos","This choice implies that I as manager, believe my employee can do well on this task. Employees like compliments",0,"nondom",1,2.6,"do",30,5,9,26,32,41,48,53,59,64,69,96,1,3,1,6,2,2,2,2,4,3,1,1,1,57,"white","4yearColl","$80,001-$100,000","woman","Full-time",NA
190,"neg","The employee might think he has to try even harder then he ever has and over work himself.",0,"nondom",1,3.4,"skip",10,2,5,28,31,39,34,57,78,93,94,100,5,2,5,7,1,6,1,1,1,5,1,0,0,18,"black","GED","$100,001-$120,000","man","NA","Good simple study"
191,"neg","The employee might feel pressured and micromanaged by the manager tone which comes off as demanding and transactional rather that supportive this could lead them to feel understand as if their effort is only being measured by the bonus outcome and not their overll contribution or well- being.",0,"nondom",1,3.9,"do",34,7,51,67,43,74,51,52,54,78,54,77,4,3,6,6,3,4,4,6,2,1,1,1,1,33,"black","4yearColl","$60,001-$80,000","man","Full-time","had a great study"
192,"pos","The might respect my candidness if I send this kind of message.  The message is straightforward and to the point.  No sugar coating.",1,"dom",4,3.4,"skip",40,4,10,20,30,40,50,60,71,80,89,100,4,4,3,3,2,4,3,3,2,6,1,1,1,39,"white","GED","$40,001-$60,000","man","NA",NA
193,"pos","it sounds like a coach pumping him up so that will give the courage  to complete the job",0,"nondom",1,1.3,"do",37,4,5,10,15,20,25,30,35,40,45,50,1,2,1,1,1,2,1,1,1,2,1,1,1,38,"black","GED","$20,001-$40,000","woman","Full-time",NA
194,"pos","The manager is encouraging me to do my best. My manager wants me to earn a bonus for my hard work.  My manager believes I can complete the task.",0,"nondom",1,2.8,"do",40,6,10,20,30,40,50,60,70,80,90,100,5,3,4,4,1,5,1,1,2,2,1,1,1,46,"other","MA","$100,001-$120,000","woman","Full-time",NA
195,"pos","It's supportive and competitive sounding, to say ""do your absolute best"" is a good way to encourage someone to work hard.",1,"dom",6,4.3,"do",36,7,100,100,85,81,89,78,79,82,94,100,7,5,5,4,3,7,3,3,1,5,1,1,1,26,"hispanic","4yearColl","$40,001-$60,000","woman","Full-time",NA
196,"pos","This message is best for somebody who likes challenges and is rewarded by hard work. Somebody who doesn't mind being pushed to the limit in order to succeed would take this message positively.",0,"nondom",2,3.1,"do",35,4,10,20,30,40,50,60,70,80,90,100,5,4,2,2,4,5,1,2,2,4,1,1,1,40,"black","2yearColl","$80,001-$100,000","man","Full-time",NA
197,"neg","They might think that they are being judged with how they perform, which would make them feel very anxious moving forward.",0,"nondom",1,1.6,"skip",28,2,12,24,33,41,50,56,63,75,87,100,4,1,1,1,1,4,1,1,1,1,1,1,1,25,"white","4yearColl","$80,001-$100,000","man","Full-time","None thank you!!"
198,"pos","They might feel inspired and like they need to impress the manager",1,"dom",4,3.3,"do",25,5,10,20,30,40,50,60,70,80,90,100,5,3,3,5,3,3,2,3,3,3,1,1,1,40,"asian","2yearColl","$160,001-$180,000","woman","NA",NA
199,"neg","This task is been known for a while. It is expected of you to get it done.",0,"nondom",2,3.2,"do",50,7,5,8,11,15,20,26,34,38,42,50,4,3,2,5,1,5,1,7,1,3,1,1,1,42,"white","2yearColl","$60,001-$80,000","man","Full-time",NA
200,"neg","The employee might react negatively towards the message because it sounds like a threat.",0,"nondom",2,4.1,"do",45,1,10,20,30,40,50,60,70,80,90,100,4,3,6,4,4,6,2,4,5,3,1,1,1,33,"asian","MA","$140,001-$160,000","man","Full-time",NA
201,"neg","The employee may feel like this message is pressuring them, and might be a vaguely threatening thing to read before this task. They might think the manager is desperate for a bonus as well.",0,"nondom",1,2.1,"do",43,2,60,70,80,90,90,100,100,100,100,100,3,1,2,3,1,4,2,1,3,1,1,1,1,30,"white","2yearColl","$0-$20,000",NA,"NA",NA
202,"pos","This is my chance to really go above and beyond and prove myself in this task.",0,"nondom",2,2.1,"do",41,6,10,20,30,40,50,60,70,80,90,100,2,2,2,2,1,2,1,6,1,2,1,1,1,36,"white","4yearColl","$140,001-$160,000","man","Full-time",NA
203,"neg","It seems almost threatening in nature. It's also adding quite a bit of stress to the user by letting them know the consequences of failing.",1,"dom",5,3.3,"do",45,2,100,90,90,85,80,70,35,0,0,0,5,2,1,5,1,6,2,2,6,3,1,1,1,37,"white","MA","$100,001-$120,000","man","Full-time","N/A"
204,"pos","Although I don't think they would have a good feeling about this, but i think it would be helpful as they feel like everythign is honest",0,"nondom",1,1.5,"do",30,4,100,100,100,100,100,100,100,100,100,100,2,1,1,1,3,1,1,1,1,3,1,1,1,NA,"white","PHD","$80,001-$100,000","woman","Full-time",NA
205,"pos","This message should motivate the employee to do their best because it is encouraging without being forceful, so they should not feel to much pressure when reading it.",0,"nondom",2,2,"do",45,6,10,20,25,31,40,50,59,73,87,100,2,3,1,1,2,4,1,1,2,3,1,1,1,40,"white","2yearColl","$40,001-$60,000","man","Full-time",NA
206,"pos","the employee might feel that the manager has high expectations and trust in their ability to suceed which can be motivating they could also appreciate the clear communications about the stakes seing the manager are someone.",0,"nondom",1,4.2,"do",30,6,35,68,13,17,22,27,35,37,44,49,4,2,6,7,3,6,4,5,3,2,1,1,1,33,"black","4yearColl","$40,001-$60,000","man","Full-time",NA
207,"neg","They might feel pressured, undervalued or resentful towards the manager",0,"nondom",3,3.6,"do",28,6,25,34,37,27,45,30,53,51,79,73,5,2,4,4,3,4,4,5,2,3,1,0,0,38,"white","4yearColl","$40,001-$60,000","man","Full-time",NA
208,"neg","I don't like how the manager is treating me. He is using money as a tool against me.",0,"nondom",2,3.9,"do",27,3,16,30,35,40,46,57,65,74,84,92,5,5,3,4,3,4,5,4,3,3,1,1,1,27,"white","4yearColl","$40,001-$60,000","man","Full-time",NA
209,"pos","By now you know about the task at hand. I know you will get in there and do the best you can around all the rounds. Understand, if you don't complete the task nor do it well, you will unfortunately not receive the complete bonus but we know you tried.",0,"nondom",1,2.1,"do",26,3,3,8,13,19,23,29,33,39,44,50,3,2,1,1,1,3,1,7,1,1,1,1,1,69,"white","2yearColl","$80,001-$100,000","woman","NA","Thank you for the study"
210,"pos","I think that the individual could have positive thoughts about this message because it appears that the message is encouraging. It gives the individual freedom to complete the task, and the manager is saying that all they need to do is to complete their absolute best.",1,"dom",4,2,"do",40,6,0,4,7,13,23,44,75,100,100,100,4,2,2,1,1,3,1,2,2,2,1,1,1,27,"white","4yearColl","$60,001-$80,000","woman","Full-time",NA
211,"neg","The manager may be condescending by saying that the employee needs to complete the task and do it well, as if the employee needs to be reminded that their normal work won't be good enough. The employee might feel disrespected.",0,"nondom",2,1.3,"do",45,3,10,21,30,40,50,70,80,87,95,100,1,1,1,1,2,2,1,1,1,2,1,1,1,42,"white","2yearColl","$60,001-$80,000","man","Full-time",NA
212,"pos","The employee might have a positive reaction to this message because it is direct and straightforward as opposed to ambiguous",1,"dom",5,2.6,"do",37,3,10,20,30,40,50,60,70,80,90,100,5,2,3,2,2,2,2,2,3,3,1,1,1,46,"white","MA","Over $200,000","man","Full-time",NA
213,"neg","Because it implies that the manager does not really have their back when it comes to the assignment. Its also more of an order than a team building exercise or something that the manager is being supportive with.",0,"nondom",2,3,"do",35,2,0,0,10,10,25,35,50,65,75,100,5,5,2,3,3,1,2,1,5,3,1,1,1,25,"white","2yearColl","$40,001-$60,000","man","Full-time",NA
214,"neg","This message puts too much emphasis on the bonus. It gives the sense that the employee will get in trouble if they don't get a perfect score. This will raise the stress level, which increases the likelihood that they will mess up.",0,"nondom",1,2.2,"skip",35,1,10,20,30,40,50,60,70,80,90,100,3,3,1,2,1,6,1,1,1,3,1,1,1,33,"white","2yearColl","$60,001-$80,000","man","Full-time",NA
215,"pos","They could have a positive reaction to that message because it indicates that they as the employee have control over their bonus and feel that they will be rewarded for doing well.",0,"nondom",2,3.1,"do",42,4,0,0,5,20,35,45,55,75,90,100,5,4,1,2,3,5,2,2,3,4,1,1,1,36,"white","4yearColl","$120,001-$140,000","man","Full-time",NA
216,"neg","They may think that the manager is implying they are incapable when they hear they will not get the bonus if they don't work well.",1,"dom",4,3,"do",40,5,80,90,100,100,100,100,100,100,100,100,5,4,2,2,6,2,2,2,2,3,1,1,1,35,"white","MA","$20,001-$40,000","man","Full-time","None"
217,"neg","Someone may feel like pressure is on them to perform. They may feel like they have no choice to not do the task.",0,"nondom",2,1.8,"skip",25,3,6,13,21,29,40,45,50,60,80,100,1,2,1,1,2,4,2,1,2,2,1,1,1,49,"white","4yearColl","$100,001-$120,000","woman","Full-time",NA
218,"neg","The end of the message feels threatening, intimidating the employee about not getting a full bonus.  It also feels commanding, stating that ""it's time to get in there and do your absolute best"".",0,"nondom",2,2,"do",20,3,20,30,40,50,56,60,70,85,90,100,2,4,1,1,3,2,2,1,2,2,1,1,1,48,"white","2yearColl","$80,001-$100,000","man","Full-time",NA
219,"neg","It may make them resent the manager or not work to the fullest capability.",0,"nondom",1,2.9,"do",50,5,1,3,5,7,7,7,5,5,6,100,5,5,2,2,2,2,2,1,2,6,1,1,1,39,"multiracial","GED","$20,001-$40,000","man","Full-time",NA
220,"neg","You are using a stick instead of a carrot. I think people would rather be praised/encouraged rather than threatened.",0,"nondom",2,2.8,"do",40,2,100,100,100,100,100,100,100,100,100,100,5,5,2,3,2,5,1,1,2,2,1,1,1,46,"white","2yearColl","Over $200,000","man","Full-time",NA
221,"pos","They may feel positive that the manager has faith in the fact that they are well aware and capable of the task.  They may also like the encouragement to go ahead and do their best.",0,"nondom",2,3,"skip",35,3,10,10,10,10,10,10,10,10,10,10,5,4,1,1,2,4,3,2,3,5,1,1,1,46,"white","4yearColl","$160,001-$180,000","woman","NA",NA
222,"neg","It assumes the employee knows the task already. Message sounds more demanding than encouraging.",0,"nondom",2,2.6,"do",50,3,10,20,30,40,50,60,70,80,90,100,5,1,1,2,3,5,2,1,3,3,1,1,1,27,"white","4yearColl","$140,001-$160,000","man","Full-time",NA
223,"neg","the message is kind of negative, so a negative response wouldn't be odd to me. I think it's basically a threat and not motivating them at all",0,"nondom",1,2.6,"skip",25,2,7,11,17,23,30,40,49,57,69,100,5,2,1,1,2,5,1,1,2,6,1,1,1,30,"white","4yearColl","$180,001-$200,000","woman","Full-time",NA
224,"neg","The tone of the sentences seem condescending therefore could be discouraging",0,"nondom",1,2.3,"skip",28,2,3,13,27,38,47,59,63,76,84,100,5,2,2,1,3,2,1,1,3,3,1,1,1,37,"asian","4yearColl","Over $200,000","woman","NANA",NA
225,"pos","This message sounds most personally supportive. They know the task and and are psyching them up, not demanding.",1,"dom",6,1.9,"do",35,5,10,27,50,50,73,85,85,95,100,100,2,1,1,2,1,1,2,1,4,4,1,1,1,40,"white","4yearColl","$60,001-$80,000","woman","Full-time",NA
226,"pos","If the employee has a competitive nature, asking them to do their absolute best may activate that motivation. The phrase ""It's time to get in there"" sounds very much like something a high school sports coach would say, and I feel like this would encourage the employee to see you as their coach.",0,"nondom",2,2.2,"do",25,3,50,100,100,100,100,100,100,100,100,100,2,1,5,2,1,5,1,1,3,1,1,1,1,36,"white","MA","$0-$20,000","woman","NA",NA
227,"neg","This message is not encouraging and comes across as a threat.  If you don't do it, you will not get the full bonus.  It is not at all warm or friendly.",0,"nondom",1,2.2,"skip",36,2,50,50,75,100,100,100,100,100,100,100,2,2,2,1,2,2,2,1,3,5,1,1,1,48,"white","GED","$160,001-$180,000","woman","NA",NA
228,"neg","The message is using the threat of not getting a bonus to try to inspire the person to do well. Not everyone responds well to threats, so it can be viewed very negatively.",0,"nondom",1,2.3,"skip",30,1,19,29,40,50,60,70,75,80,90,100,2,6,2,2,2,2,1,2,2,2,1,1,1,48,"white","4yearColl","$140,001-$160,000","man","Full-time",NA
229,"pos","I believe it is implied in the message should the employee did a good job he will get a full bonus. So that's the positive thing he will take from the message.",0,"nondom",1,3.2,"skip",36,2,5,10,15,20,25,30,35,40,45,50,5,4,2,4,3,5,2,2,2,3,1,1,1,32,"black","4yearColl","$160,001-$180,000","man","Full-time","I have none."
230,"neg","'Do your absolute best' may put unwanted pressure on the employee. There's also a difference between completing something and doing it well, the latter being an additional factor for the employed to worry about. I'd wager the employee might worry more about doing well than completing the task, feeling their manager only cares about what looks best and not the pressure their employee feels.",0,"nondom",2,1.6,"do",40,3,11,15,27,35,51,68,70,85,90,100,1,1,1,1,1,1,2,1,3,4,1,1,1,28,"white","4yearColl","$0-$20,000","woman","Full-time",NA
231,"pos","I feel that adding the ""if you don't"" part gives off a negative emotion. You want to encourage not scare.",0,"nondom",1,4.8,"do",50,7,0,0,0,10,15,25,40,60,80,100,7,5,6,5,6,5,4,1,5,4,1,1,1,21,"black","GED","$0-$20,000","man","NA",NA
232,"neg","It seems a little demanding and could cause the employee to no longer want to complete the task. “get in there and do your absolute best across all round” isn’t encouraging but demanding.",0,"nondom",1,2.2,"skip",35,2,60,75,75,80,80,85,85,90,95,100,5,2,2,1,1,5,1,1,1,3,1,1,1,36,"black","2yearColl","$40,001-$60,000","woman","Full-time",NA
233,"pos","I think the whole message is positive.  The last part may throw some pressure but it is not saying they will fail.  I think if i received this message it would be clear and to the point.",1,"dom",5,2.8,"do",40,5,100,100,100,100,100,100,100,100,100,100,5,3,1,2,3,5,1,1,2,5,1,1,1,45,"white","2yearColl","$160,001-$180,000","man","Full-time",NA
234,"neg","This message might make the employee feel pressured and controlled, seeing the manager as demanding and unsupportive rather than encouraging, which could damage trust. They might feel their autonomy is being undermined, leading to resentment or a perception that the manager is only focused on their own bonus.


",0,"nondom",1,1.2,"do",30,2,10,20,30,40,50,60,70,80,89,100,1,1,1,1,2,1,1,1,1,2,0,1,0,25,"black","4yearColl","$160,001-$180,000","man","Full-time",NA
235,"neg","The employee could interpret this message as demoralizing and demanding. It leaves little to no room for human error, which can be frustrating!",0,"nondom",1,1.2,"do",50,5,50,50,50,50,50,100,100,100,100,100,1,1,1,1,1,1,1,1,2,2,1,1,1,37,"white","4yearColl","$80,001-$100,000","woman","NA","N/A"
236,"neg","the employee might feel like i am badgering them to do the task. they may also feel like i am not being supportive in a positive and encouraging way.",0,"nondom",1,2.6,"skip",10,1,10,20,30,40,50,60,70,80,90,100,5,2,1,1,2,6,2,2,2,3,1,1,1,46,"multiracial","4yearColl","$100,001-$120,000","woman","Full-time",NA
237,"neg","The employee can have a negative reaction due to this message containing more negative tone. It puts more weight on the employee as it brings in the fact that they will not get the complete bonus if they dont do a good job.",0,"nondom",1,2.9,"do",46,6,5,5,10,10,20,25,25,50,50,50,3,3,3,3,2,5,3,1,3,3,1,1,1,29,"asian","4yearColl","$40,001-$60,000","woman","Full-time",NA
238,"neg","They feel like their being pressured to perform well, if not they won't be getting a bonus. It feels forced.",0,"nondom",2,2.4,"skip",37,3,12,29,33,41,45,57,72,83,94,100,2,2,2,2,1,3,5,1,2,4,1,1,1,35,"asian","2yearColl","$100,001-$120,000","woman","Full-time",NA
239,"neg","I think it is pretty negative when it states ""if you dont complete it and do well, you will not get the full bonus""",0,"nondom",1,1.9,"do",40,6,100,100,100,100,100,100,100,100,100,100,2,2,2,2,2,2,1,1,2,3,1,1,1,31,"white","MA","Over $200,000","woman","Full-time",NA
240,"pos","The message seems energized and exciting. It is encouraging in a way that may pump up the person and encourage them to do well at the task.",1,"dom",6,2,"do",50,6,100,100,100,100,100,100,100,100,100,100,3,2,1,1,1,4,1,2,1,4,1,1,1,37,"white","GED","$100,001-$120,000","woman","Full-time",NA
241,"pos","They would be motivated to do well. If they do well and get rewarded they will appreciate their manager.",1,"dom",5,3.8,"do",50,6,17,39,61,80,100,100,100,100,100,100,6,4,3,3,2,6,2,2,6,4,1,1,1,42,"other","PHD","$100,001-$120,000","man","Full-time",NA
242,"pos","My manager thinks I can do my best. They want me to succeed so I will get my bonus.",1,"dom",5,2.4,"do",31,6,10,20,29,40,54,59,70,79,91,100,2,2,2,2,1,4,3,1,3,4,1,1,1,41,"white","GED","$60,001-$80,000","woman","Full-time",NA
243,"pos","The employee might appreciate the manager's directness and clarity. understanding that the message shows the manager has high expectation and believes they are capable of doing well.",0,"nondom",2,4.1,"do",41,5,33,42,52,55,58,64,67,66,70,72,4,3,7,6,1,5,6,5,1,3,1,1,1,33,"white","4yearColl","$40,001-$60,000","man","Full-time","Thanks for the opportunity"
244,"pos","The employee may see this message as positive because the manager is suggesting that the employee typically does a great job and that on this task it should be no different.",0,"nondom",1,3.6,"do",40,3,0,10,20,30,40,50,60,70,90,100,6,3,2,6,2,6,1,5,2,3,1,1,1,27,"multiracial","PHD","$160,001-$180,000","man","Full-time",NA
245,"pos","They are assuming they know the task at hand and don't need a refresher. It also also fairly curt in the delivery.",0,"nondom",1,2,"skip",15,2,100,100,100,100,100,89,86,85,81,78,2,7,1,1,1,1,2,1,2,2,1,1,1,43,"white","GED","$180,001-$200,000","man","Full-time",NA
246,"neg","The employee might feel micromanaged, pressured, or threatened by the message, perceiving it as a lack of trust in their abilities.",0,"nondom",1,4.1,"do",37,6,66,88,82,67,66,66,78,69,75,70,6,2,5,5,3,6,3,6,2,3,1,1,1,24,"black","4yearColl","$40,001-$60,000","man","NA",NA
247,"neg","Well.. ..To say the least, this particular messaging is Patronizing.  And, controlling.  

That, I make it sound like I'm the one who's determining my employee's fate, also, doesn't help matters.",0,"nondom",1,2.3,"skip",0,1,0,21,30,40,50,60,70,80,90,100,4,1,2,2,1,4,1,2,2,4,1,1,1,43,"black","GED","$20,001-$40,000","man","Full-time","i think i'd rather have worked on the shape-picker task. :-)."
